site,title,title_en,year,reviewer,review,review_length,rating
watcha,오징어 게임 시즌 1,SquidGameSeason1,2021,Alexiah,이토록 완벽한 각본은 지금껏 본적이 없다. 주연들의 배경 설정이 정말 탁월한 것이 다른 데스게임과 대비되는 차별점. 실제로 주위에 있을법한 '자본주의의 패배자'들을 캐릭터로 잡아놓은 덕분에 하나 하나 리타이어될 때마다 심장을 조여오는 듯한 느낌을 받았다. 모두가 다 아는 어릴 적 게임으로 생사가 결정되는 아이러니도 최고. 이토록 쫄리는 느낌을 준 영상물은 난생 처음. 자칫 루즈해질 수 있는 후반부에도 반전을 거듭하는 스토리와 예상치 못한 전개로 끝까지 정말 너무나 재밌었다. 요근래 본 드라마 중 최고의 드라마.,288,5.0
watcha,오징어 게임 시즌 1,SquidGameSeason1,2021,임중경,"장르적인 쾌감을 다소 포기하고 사회 현실을 비유하고 있다기엔, 컨셉과 주제 사이의 내재적 모순이 너무 커보인다. 악만 쓰면 사회 비판인줄 아는 전형적인 한국 콘텐츠의 연장선에 있지만, 새로운 장르에 대한 가능성만큼은 뚜렷하다.",126,4.0
watcha,오징어 게임 시즌 1,SquidGameSeason1,2021,박철우,미쳤다 진짜.. 가면 갈수록 미친거다 ㅋㅋ 별 10개 줄 수 없나 아.. 너무 재밌다 진짜..,52,5.0
watcha,오징어 게임 시즌 1,SquidGameSeason1,2021,airness,"이거 저거 섞여 있다고 혹평들 일색인데... 창의적인건 이미 나와 있는 것을 어떻게 잘 재조작하느냐가 관건.. 난 배우들 보는 맛에 이틀만에 정주행했는데. 특히 이름은 잘 모르지만 익숙한 조연들 보는 맛도 있고 전개가 심쫄하면서도 감동적이고 재미만 있던데..  스티브 잡스 에어팟 아이폰은 뭐 오리지날인가? 이거 저거 짬뽕한거지~(나도 앱등이지만 ㅎㅎ) BTS는 그렇게 열광하면서 왜 영화는 못 까서 난리지?! 이 정도면 한국도 일취월장한거 아닌가? 칭찬, 격려 해주면 어디가 덧나나? 맨날 까기 바쁜 사람들.. 에효.",290,2.5
watcha,오징어 게임 시즌 1,SquidGameSeason1,2021,진면목,인간 본성에 대해 잘 표현한 작품 같음,21,3.5
watcha,오징어 게임 시즌 1,SquidGameSeason1,2021,망고무비,"겉핧기식 풍자, 클리셰와 감성팔이.",19,2.5
watcha,오징어 게임 시즌 1,SquidGameSeason1,2021,J Kim,어차피 배틀로얄식 게임이지만 초반 설정은 매우 신선하게 다가왔는데 후반부로 갈수록 무지성 살인게임으로 변해가서 몰입감과 재미가 급격히 하락했다.,80,3.5
watcha,오징어 게임 시즌 1,SquidGameSeason1,2021,햄튜브,징어징어 오징어~~,10,5.0
watcha,오징어 게임 시즌 1,SquidGameSeason1,2021,유권민,"꽤나 잔혹한 장면이 나열되는데 묘하게 자극이 안된다. 장르적 재미는 거세된, 돈에 대한 욕망포르노라는 아이러니. 은근히 스케일이 소박하다.",77,0.5
watcha,오징어 게임 시즌 1,SquidGameSeason1,2021,랩퍼 M군,내가 제일 좋아하는 스타일의 드라마 일본에서만 보던 류를 우리나라에서도 봐서 너무 반갑고 재밌었다,54,4.0
watcha,오징어 게임 시즌 1,SquidGameSeason1,2021,민서,진심 가면갈수록 가관 혼자 2000년대로 가버린 듯한... 7화쯤에 vip룸에서 여자들이 알몸으로 목받침. 탁자 하는거 보고 그냥 끔 자극적인 요소를 사람 죽는거랑 여자 패는걸로 채우는 노답 드라마.,111,4.0
watcha,오징어 게임 시즌 1,SquidGameSeason1,2021,창민,그 잔인함마저 잊게하는 게임의 중독성.,21,3.0
watcha,오징어 게임 시즌 1,SquidGameSeason1,2021,SH,생존을 위한 처절한 몸부림. 본능 앞에 무너지는 인간성. 지극히 사실적으로 표현한 인간의 모습. 저런 상황에서 기훈처럼 행동할 수 있는 사람이 몇이나 될까.,87,2.0
watcha,오징어 게임 시즌 1,SquidGameSeason1,2021,고양이가물어,이 드라마에서 좋았던 점은 아트웍이나 스토리나 연기가 아닌 사운드였다.  자막없이도 배우들 대사가 아주 또렷하게 잘 들렸다!!!  이게 대체 얼마만인지. 한국드라마영화는 대사가 안들려 짜증나는 경우가 많아서 볼까말까 고민을 했던 것이 바보같이 느껴질 정도로 대사들이 너무 잘들렸다.  메이킹을 보니 배우들 얼굴 바로 옆까지 붐마이크가 바짝들어가 있었다.  아주 좋았다.,206,3.5
watcha,오징어 게임 시즌 1,SquidGameSeason1,2021,첨자,데스게임 장르 잘 안 본 사람들에겐 신선하긴 하겠으나ㅋㅋㅋㅋ이걸로 국뽕을 먹고 있다면 민망한 것입니다......,62,2.5
watcha,오징어 게임 시즌 1,SquidGameSeason1,2021,진상명,스포일러가 있어요!!보기,13,0.5
watcha,오징어 게임 시즌 1,SquidGameSeason1,2021,써니쨩,생각보다.. 노잼… 1.5배속으로 10초뒤 재생 여러번… 게임 소재는 재밌는데 그외에 주변이야기는 노잼… 9화까지 만들필요는 없었던거같음.. 홍보 마케팅이 살렸다… 그리고 왤케 정성이야 진짜?ㅋ 456명마다 다른 옷과 신발을 다 맞추고… 밥도 주고.. 재워주고… 화장시키고.. 진짜 지랄도 정성… 또라이만 가능한 정성이다 이거예요…. 팝스멜팅 정재녹아내리는중… 정기고 닮았어 ..,212,5.0
watcha,오징어 게임 시즌 1,SquidGameSeason1,2021,LAY,13년동안 구상한 각본이면 이래도 되는거니 묵은때 다 집어넣었으면 결말이라도 광이 나던지 이도 저도 아닌 구상에 시즌2를 내놓으시겠다?,75,5.0
watcha,오징어 게임 시즌 1,SquidGameSeason1,2021,범준,이런 이야기에서는 어떻게 살아남을 것인가보다는 어떻게 죽음을 맞이할 것인가가 더 중요하다.,50,5.0
watcha,오징어 게임 시즌 1,SquidGameSeason1,2021,릉히,디피가 너무쎘어........  0919 코멘트 수정 디피가 너무 쎘다는 말 취소.....취소 취소 개개개개개개재밌다,65,4.0
watcha,오징어 게임 시즌 1,SquidGameSeason1,2021,등쉰들,ㅋㅋ 왓챠 아니랄까봐 지금 전세계에서 최고의 인기를 누리고 있는데 정작 여기 우물안 씹선비 PC충들 꼬라지 봐라 그 지독한 PC충 본토인 미국이 오히려 인기 좋음 미국은 물론 대부분의 전 세계 국가에서 평이 좋은데 여기만 이상하다는 건 오히려 누가 더 구시대적이고 아싸스러운지 딱 나오지 니들이 여기서 아무리 불편해해도 전 세계가 다 오징어게임 얘기만함 ㅅㄱ,200,4.0
watcha,오징어 게임 시즌 1,SquidGameSeason1,2021,때로는최고,공유딱지존나잘침 이러다다죽을만큼,17,3.5
watcha,오징어 게임 시즌 1,SquidGameSeason1,2021,미지의세계,너랑 나랑은 깐부~  21.09.28,20,2.0
watcha,오징어 게임 시즌 1,SquidGameSeason1,2021,SH,힘빠진 후반부  @넷플릭스(2021.09.27),26,0.5
watcha,오징어 게임 시즌 1,SquidGameSeason1,2021,살벌한놈,"유치함과 신선함의 경계에서 갈팡질팡. 흥미로운 지점들이 없지 않지만 납작하고 매력없는 캐릭터들과 유치찬란한 대사, 식상한 전개가 불쑥 불쑥 과속방지턱처럼 튀어나와 극의 몰입을 막아서곤 한다.",106,0.5
watcha,오징어 게임 시즌 1,SquidGameSeason1,2021,하령,VIP라는 놈들이 사슴 고양이 탈 쓰고(ㅋㅋ) 중년남성 둘이 빗속에서 치고박는걸 흥미진진하게 본다. 볼게그렇게없니..?넷플릭스 공구해...근데 오징어게임은 보지마..  대충 어디서 본 건 많은 사람이 만든 드라마같음 연출부터 캐릭터 대사까지 신선함이 하나도 없다. 사회의 어두운 면은 죄다 건드리고 싶었는지 식상하디 식상한 소재들을 (불법체류외노자 장기매매 가정폭력 도박중독가장 )뻔한 묘사로 그냥 넣기 좋은 부분만 따다가 누덕누덕 기워냄. 덕분에 깊이도 없고 클리셰만 반복됨^^ 잔인하려면 진짜 아싸리 잔인하던가 그러면 고어한 재미라도 있지..,305,3.5
watcha,오징어 게임 시즌 1,SquidGameSeason1,2021,Ham,"감독이 10년을 묵혔다 세상에 나온 시나리오, 하지만 과감히 버릴줄도 알아야. .",45,0.5
