site,title,title_en,year,reviewer,review,review_length,rating
watcha,오징어 게임 시즌 1,SquidGameSeason1,2021,Pinkman,이유미를 보기 위한 목적으로 본 거긴 하지만 그래도 최소한의 기대는 있었는데 날 이렇게 실망시킨 것까지 모자라 망신까지 시키다니……. 내가 제일 싫어하는 요소 세 가지를 고루 갖췄다.  첫 번째는 캐붕이다. 이정재가 지 엄마한테 치킨값 등처먹는 패륜을 일삼는데 도대체 왜 난생처음 보는 할아버지에게 그렇게 헌신적인지. 이 드라마 정말 갈 데까지 갔다 싶으면서도 둘이 구슬치기 하면서 깐부네 어쩌네 할 때 하 설마 이정재가 할아버지의 숨겨진 아들일까 봐 너무 조마조마했고… 뭐 깐부치킨 먹고 싶다는 생각밖에 안 들었다.  두 번째는 연출과 대사가 너무나도 구리다. 하차를 결심하게 된 6화 구슬치기 씬에서 차라리 집에서 DIY로 만든 미니어처 하우스 세트 배경이 더 낫겠다. 도대체 200억은 어디에 들인 것인가? 유일한 기대이자 희망이었던 이유미 x 새벽 씬에서도 대사가 너무 오글거려서 차마 집 텔레비전으로 볼 수가 없어서 계속 스킵하면서 봤다.  세 번째는 여혐버무리. 웬만한 수준이면 흐린 눈 하고 보겠는데 우스꽝스러운 “미녀”라는 캐릭터를 앞세워 한심하기 짝이 없는 프레임은 여캐에게 다 씌우는. ㅋㅋㅋ  스위트홈에 이어서 번번이 넷플릭스에서 공개되는 한국 드라마들은 정말 민망할 정도다. 더 체어나 보러 가야지.,627,2.5
watcha,오징어 게임 시즌 1,SquidGameSeason1,2021,청소년관람불가,클리셰가 넘치는 드라마,12,1.0
watcha,오징어 게임 시즌 1,SquidGameSeason1,2021,앙리,신파랑 감정선이 너무너무 들어가있다...,22,2.5
watcha,오징어 게임 시즌 1,SquidGameSeason1,2021,IDA,유해하고 불건전하며 시대착오적인 자극적 드라마,25,0.5
watcha,오징어 게임 시즌 1,SquidGameSeason1,2021,leo,가장 순수하던 어린시절의 게임으로 가장 잔인한 욕망의 끝을 향해간다,37,5.0
watcha,오징어 게임 시즌 1,SquidGameSeason1,2021,elihpenic,이거 재밌다는 사람도 다시 보임,17,4.0
watcha,오징어 게임 시즌 1,SquidGameSeason1,2021,볼휘,웅성웅성👥👤👥뭐야..👤👥..나만 재밌나봐.. 완전 쫄깃쫄깃쫀디긴데ㅋㅋ 연기 아쉬운 몇이 있긴함,52,0.5
watcha,오징어 게임 시즌 1,SquidGameSeason1,2021,이진수/(Binary),“내 도자기 펭귄은 항상 남쪽을 보고있어요”,24,2.0
watcha,오징어 게임 시즌 1,SquidGameSeason1,2021,연듀부,와… 여기저기서 다 끌어온 건 둘째 치고서라도 모든 부분이 시대를 역행하고 있다. 이리 빨리 포기한 드라마는 난생처음. 욕 하는 입이 아까울정도. 알리가 연기 제일 잘함.,95,0.5
watcha,오징어 게임 시즌 1,SquidGameSeason1,2021,뚱이에요,장점은 딱 두가지 뿐이다. 감각적인 미술과 의상이 만들어낸 세트. 과하지 않은 절제된 음악. 그렇다고 데스게임 장르의 생명인 서스펜스까지 절제할 필요는 없잖아.,89,0.5
watcha,오징어 게임 시즌 1,SquidGameSeason1,2021,윤종원,수많은 배틀로얄 아류작들 사이에서도 오징어가 된 감정 과잉의 클리셰 게임.,41,3.0
watcha,오징어 게임 시즌 1,SquidGameSeason1,2021,ONE'S,노름에 빠져 살다 이혼 당하고 노모에게 빨대 꽂으며 자기연민과 열등감에 빠져 살던 전형적인 한국남자가 같잖은 정의감과 박애주의에 빠져서는 마지막까지 딸과의 약속은 지키지도 않는다 노모를 등쳐먹고 결국 죽음까지 몰고 간 기훈이 생전 처음 만난 노인 일남에게는 한 없이 베푸는 모습을 보고 있으면 정작 진짜 가족은 팽개치고 돈 버는 기계를 자처하며 바깥에서만 사람 좋은 척 하는 알맹이 없는 한국의 수많은 가장들이 생각난다 딱 하나 다른 점은 기훈은 돈도 못 버는 개등.신이었다는것.  이 빌어먹을 최저가부장제 한국은 대체 언제까지 여성을 남자의 성장과 각성에만 뒷받침 하다가 도륙 당해 죽는 캐릭터로만 활용할건지 보는 내내 예상을 빗나가지 않아서 놀랍지도 않다,368,0.5
watcha,오징어 게임 시즌 1,SquidGameSeason1,2021,이승빈,"이쯤되면 잘되는 ""K-콘텐츠""의 힘은 얼레벌레에 있다는 점을 인정할 때가 온 것 같아요.  여기서 작품의 내적 목적은 치밀해 보이는 '분위기'를 만드는 수준에서 달성되는 것이고(많이들 놀리시는 고시원의 라캉 책들을 생각해 봅시다), 그렇기에 서사의 울퉁불퉁함, 개연성 부족, 부실한 세계관 따위를 지적하는 것은 이 극에 그다지 타격이 되지는 않는 듯해요.",198,4.5
watcha,오징어 게임 시즌 1,SquidGameSeason1,2021,김원혁,"반도가 생각나는 드라마. 게임이 주된 이야기가 아닌 사람과 사람사이의 갈등이 주된 이야기지만 이상하다...  신이 말하는대로를 재평가하게 만들어주는 드라마  1화 : 참신함 없이 한국의 클리셰 설정으로 범벅. 만화 '신이 말하는대로'와 설정이 거의  똑같지만 심히 떨어지는 흥미도.  2화 : 아ㅋㅋㅋㅋㅋㅋ 하차해야하나?  3화 : 사람 죽이는 게임 앞에 두고 캠핑 온 듯한 인물들, 멍청하고 괴랄한 인물들, 말하기 게임인가? 말만 엄청하네...  4화 : 조명을 활용한 연출은 정말 최악이다... 모스부홐ㅋㅋㅋㅋㅋ, 줄다리기 어이가 없네 진짜로ㅋㅋㅋㅋㅋㅋ 이런 소재는 참신함으로 불리함을 역전시켜야 하는데, 감독이 참신한 전략의 아이디어가 없으니 어이없음으로 상황을 역전시키네  5화 : 드디어 나온 주인공의 과거부분, 너무나 클리셰하게 허상과 대사로 다 풀어버린다. 수술실 부분과 배 쪽으로 가는 일꾼들이 너무 작위적이고 오글거리는 대사들이라 황당하다. 설명충들이 누가 더 설명을 잘하는지 게임하는 회차.  6화 : 하차. 이제 그만볼래...",529,3.5
watcha,오징어 게임 시즌 1,SquidGameSeason1,2021,너른벌 김기철,몰입감있게 봤다. 추석에 오징어 열풍이 지나가고 한발 뒤에 차분히 보았다. 가증한 사전 지식 없이 보기위해 꽤나 노력했지만 온갖군데에서 알려주는 통에 대충은 알겠던데.. 그래도 몰입감 있게 보았다.  5화에서 쌍용자동차 파업 진압 장면이 오마쥬 되었을때. 2009년 당시 그 현장을 인테넷 중계하던 팀의 일원으로 현장을 지켜 보았던 기어기 다시 되살아 났다. 그리고 흐르던 눈물은..... ㅠㅠ  여태까지 이런 장르의 드라마와 영화와 다른점은... 오징어 게임은 어쨌든 스스로 경기에 참여 한다는거...  그리고 보여지는 인간 밑바닥의 모습들..  시즌 2가 어덯게 진행될지 지켜 보아야 겠다. 이번 9개의 에피는 결국 도입에 불과 했던거 같았다.  #019. 2021. 10. 05. 넷플릭스 9부작 (271),398,3.0
watcha,오징어 게임 시즌 1,SquidGameSeason1,2021,박상환,에피소드간 편차가 심하다. 거의 하늘과 땅 수준,26,3.0
watcha,오징어 게임 시즌 1,SquidGameSeason1,2021,figuier,어디서 많이 본듯한 스토리,14,4.0
watcha,오징어 게임 시즌 1,SquidGameSeason1,2021,희♡,지루하지 않고 재밌지만 너무 예상 가능하고 뻔한 전개 1화 무궁화꽃이 젤 좋았다.,45,3.0
watcha,오징어 게임 시즌 1,SquidGameSeason1,2021,나홍진,더 악랄하게 더 게임집중적으로  했다면,21,3.0
watcha,오징어 게임 시즌 1,SquidGameSeason1,2021,라이너스,"‘연출의 의도는 알겠으나..’ 라고 이해하고 싶은 기분이 들지 않는 극단적인 이야기에 낡은 캐릭터가 질주하며 총체적 난국에 도달하는… 끊을 수 없는 맛있는 불량 식품! - 눈 앞에서 사람이 죽어나가는 장면은 자극적이기 보다는 한심하게 느껴진다. 혹시나! ‘화’가 거듭되면 나아지거나 괜찮아질 거라는 기대는 곱게 접어 하늘 위로~ - 다양한 이야기를 기본 이상의 퀄리티로 뽑아내는 감독의 전작들을 생각하면…음. - (미래에서 왔습니다. 어리석은 중생아, <오징어 게임>은 시즌3까지 나온 우주적 대박 작품이 되었단다…)",289,3.0
watcha,오징어 게임 시즌 1,SquidGameSeason1,2021,Hyunjoo Park,장르 드라마의 매력이라고 생각하자.,19,3.0
watcha,오징어 게임 시즌 1,SquidGameSeason1,2021,5jp,유전무죄 무전유죄!!!,12,3.0
watcha,오징어 게임 시즌 1,SquidGameSeason1,2021,JY,이정도로 흥행할 줄은 몰랐을것 같다 한국식으로 변주한 포인트와 흥미를 높여주는 이미지가 무척 신선하게 다가왔나보다,63,3.5
watcha,오징어 게임 시즌 1,SquidGameSeason1,2021,권준희,어디가 더 지옥이냐고요? 사회요. 거기는 과반이 투표하면 함께 판을 깰 수 있었잖아요.,48,2.5
watcha,오징어 게임 시즌 1,SquidGameSeason1,2021,싱싱야도란,마지막에 힘이 좀 빠졌던것같다. 대미를 장식하기엔 게임이 약했달까.. 조금더 어렸더라면 하루만에 다 봤을테지만 9편을 이틀만에 다 봤을 정도로 흡입력이 어마어마했다.,92,2.5
watcha,오징어 게임 시즌 1,SquidGameSeason1,2021,언논논,"- 이미 고착될대로 된 '데스게임'을 이렇게밖에 변주하지 못하나. 이마저도 어디서 본듯한 레퍼런스 (신이 말하는대로, 무한도전-줄다리기)와 1차원적인 캐릭터 (깡패, 꽃뱀, 불량 청소년 등...)로 체워놓으니 그닥 자극적이지도 않다. 그나마 6화 이후엔 어느 정도 방향성이 명확해져서 볼만하긴 했다만, 고평가받은 부분있다고 생각한다.  ※이하 스포일러 있음. 1. '옛날 놀이로 데스게임'이란 컨셉은 좋은데 초반의 게임들이 너무 감흥이 없다. '술래잡기', '달고나', '줄다리기'같은 게임들은 그저 좀 특이한 대량학살 정도의 역할밖에 못한다. 2. 주연 캐릭터들이 너무 별로다. 참가자중엔 선악구도로 '기훈-상우'를 내세우고, 내부를 파해치는 역할이 잠입한 형사인 '준호'에게 주어졌는데 이중 제 역할을 다 한건 '상우'밖에 없다. 2-1. '기훈'이야 사람좋은 우유부단한 캐릭터인것까지야 납득할 수 있는데, 처음부터 끝까지 선역으로 빌드업을 쌓은 적이 없다. 자잘한 선행이야 해왔지만 명확한 자기의사가 표현된 적이 없는데 갑자기 후반~결말에서 '정의의 사도'가 되어 분노하는 꼴이 우스울 정도로. 2-2. '준호'는... 그냥 캐릭터가 매력이 없다. 등장하는 모든 장면이 목소리 내리깔고 폼잡기만 하는데 매력이 있을리가. 그렇다고 이 캐릭터가 파해친 것들이 매력이 있냐?하면... 얘가 알아낸게 진짜 뭐가 없는데?? 3. 결국 이렇게 감흥없는 데스게임과 갈피못잡는 캐릭터의 조합때문에 통 몰입을 하지 못했다. 그래서 시즌 2도 그렇게 기대되진않는데 이미 확고한 선역으로 자리잡은 주인공과 분명 뭔가 더 있긴할 프론트맨이 포지션을 잡고 시작하니 시즌 1보단 나을지도.",822,3.0
watcha,오징어 게임 시즌 1,SquidGameSeason1,2021,OSM,스포일러가 있어요!!보기,13,3.0
watcha,오징어 게임 시즌 1,SquidGameSeason1,2021,ㅇㅈㅇ,전세계 화제작이 될 줄이야.,15,2.5
watcha,오징어 게임 시즌 1,SquidGameSeason1,2021,임판호,놀이가 곧 경쟁이었던 걱정없던 어린시절의 여유가 어른이 되어선 돈이 곧 여유가 되어버린 현 시대에서 돌아갈 수 없는 리즈시절을 바라보는 이다지도 처연한 경쟁을 놀이만큼 단순하고 클리셰적인 플롯으로 이야기하는 아쉬움이 후반으로 갈수록 더해진다. 덧! 시즌2가 만들어진다면 숲튽훈좌를 다시 보게 되는건가.,168,3.0
watcha,오징어 게임 시즌 1,SquidGameSeason1,2021,상범,오징어 게임은 자본주의의 축소판.  나는 자본주의라는 의자 뺏기 게임에 참여한 참가자다. 희소한 가치를 얻을수록 익명의 누군가는 잃어야만 하는 제로썸 게임. 그럼에도 돈으로 희석되지 않는 가치들이 존재하기에.  p.s) 잘 가다가 7화부터 왜 이래요...,142,3.0
watcha,오징어 게임 시즌 1,SquidGameSeason1,2021,타퇴엽절,"어린 시절, 친구들과 이런 저런 게임을 하다보면 자연스럽게 구분이 됐다.. 누가 좋은 놈인지, 누가 나쁜 놈인지, 누가 이상한 놈인지.. 20년 동안 사회 생활을 하다보니, 그 시절 친구들과 즐겨했던 게임들이 어른들의 세상의 축소판이었다는 것을 깨닫게 된다..",145,0.5
watcha,오징어 게임 시즌 1,SquidGameSeason1,2021,만적,불쌍하긴 해 이게 재밌다고?  재밌는 걸 한 번도 못 본 건가?,35,4.0
watcha,오징어 게임 시즌 1,SquidGameSeason1,2021,나은스,아..ㅋㅋ.. 진짜 겨우 참고 봤는데 진짜 최악이다 ㅎㅎ  하 내눈...ㅎㅎ..  이런거 만들꺼면 기부나 하세요.  글쓸때 생각은 하고 쓴건가요? 뇌빼고 쓴건 아닌지? 대사 하나 하나가 쓰레기네요^^,111,4.0
watcha,오징어 게임 시즌 1,SquidGameSeason1,2021,Magnolia,인생 끝자락에서 일확천금을 바라며 피 터지게 싸우는 아수라장을 아는 이는 아무도 없다는 것.,51,1.0
watcha,오징어 게임 시즌 1,SquidGameSeason1,2021,siwon.hage,"피 묻은 돈에 대한 욕망과 현실 반영 드라마  예측 가능한 전개, 노골적이고 어설픈 몇몇 설정 높은 몰입감과 적당한 편집  *게임보다 잠이 더 무섭다.",84,4.0
watcha,오징어 게임 시즌 1,SquidGameSeason1,2021,박가을,2021년에 선보인 2008년 구상작,20,3.5
watcha,오징어 게임 시즌 1,SquidGameSeason1,2021,Dark angel,아이디어 하나로 낡은 건물을 쌈박하게 리모델링한 것 같은 효과를 낸 장르의 업데이트. 들어가 봤더니 인테리어도 나쁘지 않았다.,70,2.5
watcha,오징어 게임 시즌 1,SquidGameSeason1,2021,붉은 돼지,"1. 아이들이 하는 건 게임, 어른들이 하는 건 생존. 2. 클리셰 범벅이지만 역시 한드 만의 비틀기 한 방은 있다. 3. 이정재, 공유 그리고... 형이 왜 거기서?😅",94,4.0
watcha,오징어 게임 시즌 1,SquidGameSeason1,2021,나지수,다 용서할수는 있어도 마지막 김장훈은 아니지...,27,0.5
watcha,오징어 게임 시즌 1,SquidGameSeason1,2021,Oh,"""암행어사"". 상황을 공정하게, 뒤바꿀수 있는 게임 체인저같은 단어. 하물며 오징어 게임을 하면서도 희망적장래, 정의사회, 신분혁파, 를 꿈꾸면서 '암행어사'를 외쳤던 그 시대 동심들이었다. 그런게 될줄 알았다. 놀이터를 벗어나도, 어른이 돼서도, 최소한 넘어져도 안전한 모래는 있을거라 믿었다.  그 동심들은 빚잔치의 주역이 되었다. 국가부도, 정리해고, 금융위기, 그 모든 어려운 시간을 지난 오직 ""돈""이라는 단 한줄의 불안한 연결고리 아래의 사람들 그리고 그 위의 사람들. 그들의 자식에게 이전되는 빚. 다음 세대가 고스란히 물려받는 어마어마한 실패의 기록. 이 관계가 쌓이고 쌓여 만들어진 지금의 '빚한민국'에서 그들 모두가 다시 만났다. 빚잔치를 갚아주겠다는 죽음잔치에서. 그게 일확천금이 아니라 당장 눈앞의 빚덩이만이라도 탕감할 수 있는 기회라면 죽기살기로 달려드는 이들에게, 결국 기댈 곳은 여기뿐이다.  ""반으로 나누자."" ""반씩 나눠서 같이 나가자."" ""다 잘될거야. 나만 믿어.""  도박과 옵션과 경마와 로또만으론 해결할수없는 마이너스의 레버리지가 한계치를 넘어버렸다. <오징어 게임>은 그 마이너스의 세계다. 반 나누거나 같이 나갈수가 없다. 평등하자고? 내가 가질수있는 돈은 누군가가 잃어야만 생기는 돈이다.  - 적어도, 지금까지 내가 살아간 현실은 빚에 매여 하루하루 갚고 빌리는 것이 반복되는 괴로운 인생을 살고있는 사람들이 가득한 곳이었다. 뭐만 하려하면 ""돈 있어?""라는 질문이 당장 눈앞에 날아들어 안그래도 빈속을 아프게 쓰라리는 사회였다. 이 사회엔- 온갖 일을 다해줬지만 체불을 해도, 처음보는 사람이 뺨을 때려도, 내 몸에 손대는걸 당연하게 생각해도, 돈 앞에서 어쩌지도 못하는 사람들이 있다. 반대로 말하면 돈이 있으니까, 내가 돈을 내니까 너가 피해를 입든말든 그래도 된다는 식으로 나오는 사람들이 있는 것이다. 그렇다. '돈'이라는 키워드 안에서 이토록 사회는 매우 불공평하다. 난 어릴 때부터 이걸 믿고 싶지 않았는데 결코 반박할수없다. 현실이었다. . 이 드라마가 그런 현실을, 적나라하게 다시한번 뼈저리게 느끼게 해줬다. 나에게 이 드라마는 클리셰가 어쩌고 각본이 어떻고 평가하며 얘기하는 그저 9부작의 헝거게임 내지 범죄물로 보이지 않았다. 바로 내가 겪고 보아온 현실을 온갖 범죄들과 엮어 던져놓은, 이 사회의 지독한 초상이었다. '쩐의전쟁'이 그랬고 '기생충'이 그랬다. 다시봐도 뼈가시린 '지푸라기라도 잡고싶은 짐승들'도 그렇다. 거기다 국적/세대/성별을 넘나드는 타자화가 한번씩은 등장하며 갈등이 만연한 지금 사회 사람 사이 마이너스를 한숨으로 되새기게 한다. 외노자, 노인고독사, 성차별, 북한, 신계급주의. 눈앞의 현실을 싸늘하게 파고들어 아프게 비튼다. 사회는 그렇게 돼버렸다.  언젠가는 나올것같았던 이야기. 언젠가는 나올수밖에 없었던 이야기. 언젠간 나와야만 했던 이야기. 어디서 많이 본 방식이 나오는게 많은 사람을 불만스럽게 만들것이다. 이런 이야기를 기대하지 않았다고 말할것이다. 고어틱한게 힘들것이다. 하지만 분명 현실은 더 잔인하다. 적어도 나에겐 <오징어 게임>은 <나의 아저씨>를 보는것만같은 안타까움과 쓰라림 그 자체로 마음을 짓이겼다. 응원할수는 없는 인물들이지만, '살인게임만 없다면' 결국 지금 이 순간에도 어딘가에 살아가고 있는 사람들의 이야기이기 때문에. 빚쟁이를 잡아 노예화를 계획하고 장기밀매까지 탐내는 짐승같은 인간무리, 평생 일해도 갚지못할 빚이 있지만 간신히 버티고 살아가며 인간이길 포기하지 않으려는 인간무리, 두 극단의 대립 사이 나 역시 어느 지점을 지향하며 이 인생을 살아내야하기 때문에.  /  목숨값을 건 게임은 다시 또 시작될것이다. 그 게임은 실낱같은 희망을 좇는 사람들의 믿음을 팔아, 때론 아무 상관없는 사람의 피를 묻혀, 또한 죄지은 누군가의 댓가를 치뤄가며 흘러온 산물이다. 돈 앞에서 아등바등 살아가는 지금의 빚한민국에서, 뒷통수가 만연한 이 씁쓸한 현실에서 ""사람에 대한 믿음"" 이야기가 과연 얼마나 현실적으로 들릴까라는 아이러니가, 드라마 끝나고나서까지 날 감싼다. [어른들의 동심이 파괴된다]는 문구는 지나치게도 성공적이었다. 순간순간적인 블랙코미디조차 그 동심을 있는힘껏 짓밟았다.  ""암행어사"". 오징어 게임을 하면서 그 단어를 힘껏 외친 지금의 그가, 과연 그때 그 동심의 꿈을 실현시켜줄 수 있을까. 현실을 공정하게 뒤바꿀 수 있는, 게임 체인저가.",2175,2.5
watcha,오징어 게임 시즌 1,SquidGameSeason1,2021,아르므,Vip들 가면 쓰고 지들끼리 게임 관전하고 있는 게 왤케 하찮냐.. 2배속으로 볼걸  + 그냥 감독 사상의 추악함을 확인할 수 있었던 작품 같음 앞으로 이 감독 작품 볼 일은 없을 듯,102,4.0
watcha,오징어 게임 시즌 1,SquidGameSeason1,2021,정리함,이렇게 또 아까운 시간을 낭비해버리고...,23,3.0
watcha,오징어 게임 시즌 1,SquidGameSeason1,2021,Cinefeel,감독은 소재가 가진 장르적인 스릴감에 그닥 관심이 있었던 것 같지 않다.(잘하는데 안한 건지는 두고봐야겠지만) 감독의 장기인 휴먼 드라마와 연출력으로 마지막화까지 보게 만든 것만으로도 넷플릭스 드라마 중 괜찮은 성취물이라 생각한다.,129,3.5
watcha,오징어 게임 시즌 1,SquidGameSeason1,2021,주령,"오징어 허리춤에서 '만근추'로 버텨줄 애들이 없으니 뻥뻥 뚫리지  극의 중심을 잡을 캐릭터도, 핵심 이야기도 뚝심있게 끌고 가질 못한다. 굳이 병정과 참가자 이야기를 구분해서 진행해야 했을까. 극의 전개도 허리춤, 그니까 중반부가 너무 허술하고 지루하다. 솔직히 흑막도 처음 보자마자 딱 아는 수준이고, 굳이 2기를 낼 이야기가 아닌거 같은데 2기 여지를 주는 것도 그닥",207,4.5
watcha,오징어 게임 시즌 1,SquidGameSeason1,2021,Jung,여러분! 지금이 울 타이밍 입니다! 나 : 어허유ㅠㅠㅇ어헝홍헝헝ㅠㅠㅠ,38,4.0
watcha,오징어 게임 시즌 1,SquidGameSeason1,2021,soooorim,스포일러가 있어요!!보기,13,3.0
watcha,오징어 게임 시즌 1,SquidGameSeason1,2021,스탕달,인생은 고통 그 자체라고 말하는 것 같다. 사실 전혀 생소한 느낌을 준다거나 트렌디한 드라마는 아닌것 같지만 넷플릭스를 등에 엎고 하고싶은 대로 한 것 같아서 좋다. 작품에서 창작자가 치기어린 광기를 내뿜으며 빈 캔버스에 막 휘갈기는 뉘앙스가 날 때 나는 기꺼이 응원해주고 싶다. 화제를 불러일으켜 입소문을 타고 흥행하는 작품은 다 이유가 있다. 그만큼 서스팬스도 잘 살렸고 프로덕션도 좋았다는 방증일 것이다.,229,0.5
watcha,오징어 게임 시즌 1,SquidGameSeason1,2021,이상해씨,넷플릭스가 열어준 새로움도 K클리셰를 만나면 어쩔수 없음을,32,0.5
watcha,오징어 게임 시즌 1,SquidGameSeason1,2021,Deer,뭐 연출이 좋다고 생각하면서 보다가 진짜 점점 드는 찝찝한 기분을 씻을 수 없었고..... VIP들도 남자 진행자도 남자 마스크 쓴 알바들도 남자 참여자도 남자인 알탕에... 여자는 다 엄마거나 아프거나 시장에서 장사하고 ㅋㅋㅋㅋㅋ 진짜 시대 역행 오짐 그나마 있는 여캐들 중 하나는 뭐 말도 안 되는 억척스러움에 또 하나 있는 여캐는 뭐 말도 안 되는 이유로 목숨이 위태로우며 하... 스포라서 차마 말은 못하지만 ㅋㅋㅋㅋㅋㅋ 처음부터 끝까지 여자랑 노인 약자 취급하면서 똑같이 주는 게 공평하고 평등이라는 말은 왜 자꾸 하는지 모르겠어ㅋㅋㅋㅋㅋㅋ 운수좋은날 진짜 개헛웃음ㅋㅋㅋㅋㅋㅋㅋㅋㅋㅋㅋㅋㅋㅋㅋㅋㅋㅋㅋㅋㅋㅋ 왜 봤는지 후회스럽고 티저만 보고 끝냈어도 될 듯 그냥 잡탕임 잡탕,381,3.0
watcha,오징어 게임 시즌 1,SquidGameSeason1,2021,린둥,스포일러가 있어요!!보기,13,3.5
watcha,오징어 게임 시즌 1,SquidGameSeason1,2021,안지-바기,의정부고 졸업사진에 프론트맨 관리자 병정 일꾼 셋트로 등장하면 인정,37,3.0
watcha,오징어 게임 시즌 1,SquidGameSeason1,2021,BIGMAC_bro,"시즌 1 완료. 사실 연출이 어설프긴한데, 이정재의 연기력과 딱봐도 제작비 좀 들어갔을거 같은 세트와 엑스트라들로 화면을 꽉꽉 채운 덕분에 싼맛은 많이 날렸다. (+깜놀 까메오 ㄷㄷ) 사실 엔딩이 좀 강하진 않았지만 몰입해서 즐겼기에 만족.  6화까지 완료. 처음엔 연출이 많이 어설프고, 피로감으로 다가오는 반복적인 살인 장면이 거슬렸는데. 그래도 몰입도는 잘 연장시켜주면서 뒤로 갈수록 나쁘지 않다. 1점 추가  눈에 띄고싶은 부분에만 집중을 하려다보니, 다른 부분들이 너무 누더기다. 2화까지 든 생각. 일단 계속 보는중",294,2.5
watcha,오징어 게임 시즌 1,SquidGameSeason1,2021,라리_,2화 보고 있습니다 보기전이시라면 그냥 다른거 보세요  너무 뻔한거 아님? 할아버지  ——————————— 마지막화 까지 달렸습니다 2편까지만 보면 스포및 전개 대부분 유추 가능합니다 뻔하다는게 문제가 아닙니다 뻔해도 완급조절만 잘하면 재미있는데 굳이 필요없는 장면들을 집어넣어가면서 질질끄니까 짜증이나는겁니다 프론트맨 잠깐이였지만 연기보고 지렸네요..,197,5.0
watcha,오징어 게임 시즌 1,SquidGameSeason1,2021,토캉,"[1화만 봤는데도 망작….] 역시나 많이 기대했지만 별로네 ㅠㅠㅠ 배우들은 이렇게 좋은데 연기가 눈에 띄는것도 아니고, 너무 늘어져서 이어보고싶은 생각이 들게 만들지를 않는다 [5화까지 본 감상] 캐릭터의 매력이 없어 몰입이 안돼 장르가 스릴러인지 개그물인지 뭔지 알수가 없어 이것도 저것도 아니야 [끝까지 본 후] 6화 이후부터는 그래도 볼만해지지만 호흡이 느린건 여전하네 시즌2가 나올거같으니 그건 기대해봐도 좋을까?…",236,2.5
