site,title,title_en,year,reviewer,review,review_length,rating
watcha,오징어 게임 시즌 3,Squid Game Season 3,2025,김수지,"인간의 존엄성이 얼마의 가치를 갖는가에 대해 논하고 싶었다면, 그만큼의 깊이있는 딜레마를 다뤘어야. 자신이 없다면 오락성이라도 챙겼어야. 그마저도 자신 없으면 매력적인 캐릭터라도 창조했어야.",106,1.5
watcha,오징어 게임 시즌 3,Squid Game Season 3,2025,장명준,이야기를 풍성하게 하려고 끼워넣은 곁다리 이야기들이 메인 플롯의 힘을 쭉 빠지게 한다.,48,1.5
watcha,오징어 게임 시즌 3,Squid Game Season 3,2025,hongveler,혹시 프로토 타입으로 만든 게임인가,19,0.5
watcha,오징어 게임 시즌 3,Squid Game Season 3,2025,INK,한국판 트랜스포머,9,1.0
watcha,오징어 게임 시즌 3,Squid Game Season 3,2025,nono,내가 이런 걸 보려고 6개월을 기다린게 아닌데 그냥 뭘 하려는지도 모르겠고 기승전 찝찝함으로 끝..,55,1.5
watcha,오징어 게임 시즌 3,Squid Game Season 3,2025,랄릴루,맞아 니 때문이야.,10,0.5
watcha,오징어 게임 시즌 3,Squid Game Season 3,2025,바다리,성기훈 세상에서 가장 마주치고 싶지 않는 사람,25,3.0
watcha,오징어 게임 시즌 3,Squid Game Season 3,2025,김동휘,이딴거 만들고 입은 왜 터는 거임 대체?  ㅋㅋㅋㅋㅋㅋ 외국인 나오는 데만 떼어 모아서 서프라이즈 내보내도 이상하지 않을 듯?,70,1.0
watcha,오징어 게임 시즌 3,Squid Game Season 3,2025,노승찬,"깨지지않고 견고한 기득권의 시스템. 선과 악 사이에서 방황하는 사람들. 그 속에서 갈팡질팡하지만 꿋꿋이 중심을 지키려는 성기훈씨, 그동안 고생 많았습니다.  1화는 시즌2 8화라고 보면 적절히 쉬어가는 화지만 시즌3 1화라고 하기에는 답답하다. 시즌2 때도 얘기했지만 시즌2는 시즌2 파트1. 시즌3는 시즌2 파트2. 스토리아크(story arc)상 이어 보는게 맞다. 그리고 나는 이러나 저러나 시즌1보단 시즌2, 3가 좋았다. 하지만 게임 그 자체에 집중하는 관객들에겐 시즌1이 더 취향일듯.",277,0.5
watcha,오징어 게임 시즌 3,Squid Game Season 3,2025,허준석,"네러티브의 다층성은 사라졌고, 서로 울고불고 짜고 난리만 부릴 줄 안다.",40,0.5
watcha,오징어 게임 시즌 3,Squid Game Season 3,2025,choiyp0319,신박한 소재로 떠버려서는 끝끝내 이야기도 메세지도 캐릭터도 모든게 붕 떠버렸구나,44,1.5
watcha,오징어 게임 시즌 3,Squid Game Season 3,2025,헵번공주,■예고편) https://youtu.be/bqECUTAk9do?si=xltK5rXvNy_yRNRx,54,1.0
watcha,오징어 게임 시즌 3,Squid Game Season 3,2025,미소,이거 속편 만들 시간에 빨간 머리 앤 새 시즌 내놔,28,2.5
watcha,오징어 게임 시즌 3,Squid Game Season 3,2025,만예이,아니 힘들다고 지구야 너무 미안하다,19,3.0
watcha,오징어 게임 시즌 3,Squid Game Season 3,2025,거장민감독,멍청한 선민의식과 병신 같은 창의력이 박살내버린 역대급 ip.,34,1.5
watcha,오징어 게임 시즌 3,Squid Game Season 3,2025,CINEX,우리 노을씨가 시즌2부터 중심인물이였는데 그렇다고 시즌3에서 매력적이지도 않고 우승자가 누가 될지도 K드라마 많이 본 사람들은 짐작도 될 정도이고 시즌1으로 끝나야 전설이 됐지,98,2.0
watcha,오징어 게임 시즌 3,Squid Game Season 3,2025,던다운,진짜왜봤지,5,1.0
watcha,오징어 게임 시즌 3,Squid Game Season 3,2025,동민,"이렇게 까지 큰판에서 이정도의 갈등과 결말을 이끌어낸건 놀라웠다. 기대를 안하고 봐서 그런지 몰라도 게임들에서 벌어지는 여러가지 상황들이 재미있었다. 다만 신파가 지나치게 많은점, 게임 외부의 일들을 너무 루즈하게 풀어내어 분량을 채운점들이 지루햤기에 스킵하며 보았다. 그리고 또 열린결말..",163,2.5
watcha,오징어 게임 시즌 3,Squid Game Season 3,2025,박재민,용두사미의 완벽한 예시,12,1.5
watcha,오징어 게임 시즌 3,Squid Game Season 3,2025,위나영,안봤는데0.5점줌,9,1.5
watcha,오징어 게임 시즌 3,Squid Game Season 3,2025,뽀또,?,1,2.0
watcha,오징어 게임 시즌 3,Squid Game Season 3,2025,백혈탁,"제목 변경이 필요할 듯. 아기 살리기 게임, 섬 찾기 게임",32,1.5
watcha,오징어 게임 시즌 3,Squid Game Season 3,2025,KMH,정말 최악의 마무리 그냥 시즌 1만 하고 끝내지 왜..,30,2.0
watcha,오징어 게임 시즌 3,Squid Game Season 3,2025,로기,"그릇된 기성 세대 가치를 온전히 타파할 수 없는 현실은 반영하나, 느슨히 얼기설기 엮은 실타래처럼 시종일관 미약한 전달력이 아쉽다.",73,3.5
watcha,오징어 게임 시즌 3,Squid Game Season 3,2025,브라질 방랑거미,성기훈의 캐릭터성도 시즌제인 걸까.,19,0.5
watcha,오징어 게임 시즌 3,Squid Game Season 3,2025,뚜루11,"Aㅏ... 인기 많으니 억지로 시즌2,3 진행한 결과임 박수칠 때 떠났어야했다. 그랬다면 레전드로 남았을텐데",60,2.5
watcha,오징어 게임 시즌 3,Squid Game Season 3,2025,channy,"1. 고도로 발달한 위선자는 사이코패스와 구별할 수 없다. 2. 위선자라는 정체성을 끝끝내 지켜내는 점은 칭찬 받아야 하나, 극적인 효과를 위해 둔 무리수가 너무 많다.",94,1.0
watcha,오징어 게임 시즌 3,Squid Game Season 3,2025,Q_,황동혁씨 은퇴하시길ㅜㅜ,12,2.5
watcha,오징어 게임 시즌 3,Squid Game Season 3,2025,jojingyu88,1편 잘 됐다고 후속편 만들면 다들 제말 들으세요 제가 해봤습니다 이꼴 나는겁니다.,46,2.0
watcha,오징어 게임 시즌 3,Squid Game Season 3,2025,뭐든지 다 보는 띠용핑,감독의 주제의식에 꼭두각시처럼 휘둘리는 캐릭터들 메시지가 시리즈 전체를 집어 삼켜버렸다.,49,0.5
watcha,오징어 게임 시즌 3,Squid Game Season 3,2025,베르통언,"불필요하고 이해되지 않는 장면들에 더해지는 초라한 이야기  행동에 의미부여를 하지 않고, 의미부여에 맞춰 행동을 억지로 과하게 설정한다  그러나 교훈을 주려던 장면들은 그저 초라하고 작위적이다",107,2.0
watcha,오징어 게임 시즌 3,Squid Game Season 3,2025,박종서,차갑고 구질구질한 자본주의..,16,1.0
watcha,오징어 게임 시즌 3,Squid Game Season 3,2025,MrCult,수습불가의 고육지책,10,2.5
watcha,오징어 게임 시즌 3,Squid Game Season 3,2025,권유주,제발 그냥 게임만 했으면….,15,3.0
watcha,오징어 게임 시즌 3,Squid Game Season 3,2025,아차😅,감독이 부담이 너무 컸는지 막판에 뇌절을 좀 해서 성기훈을 병신 만들어버린 거 같다.,47,2.0
watcha,오징어 게임 시즌 3,Squid Game Season 3,2025,조이미,아무런 감정도 감상도 남지 않았던 결말,21,0.5
watcha,오징어 게임 시즌 3,Squid Game Season 3,2025,백햇,"바보를 자처하면 다 죽는다.  시즌 2에서 기훈이 게임의 기호를 넘어선 건 투쟁의 결과였다. 체제의 원칙은 여전히 변하지 않았고 지속되었다. 이 게임은 단 한명만이 살아남는다. 그 외의 모든 이는 패배자이며 죽음 속으로 퇴장한다.  일시적 환상에 불과한 동화, 영화와 같은 결말. 그 꿈은 이미 승리할 때 깨진 것이다. 오징어 게임의 세계는 현실과 게임(가상)으로 나뉘며, 이 두 세계가 겹쳐질 때 남는 건 그림자 뿐이다. 두 세계와 그림자 세계가 있는 이 곳에선 순진한 믿음은 통하지 않는다. 정의를 품는 순간, 오히려 무력해진다.  시즌 3의 결말은 우리 사회에 흐르는 무언의 규칙을 닮았다. 정의로는 살아남을 수 없으며 바보를 자처하면 끝장이 나는 구조다.  그건 더 이상 게임 속 이야기만이 아님을 보여주는 시리즈였다.  이병헌이 연기한 프론트맨, 그의 흔들리는 시각이 서사의 재미를 더했다. 그가 끝내 체제의 승리를 묵인한 채 떠나지 못하고 지켜보는 모습은 그저 씁쓸함만 남긴다. 그 외에도 무력함을 보이는 내러티브 장치들을 보는게 힘들고 답답했다.   쓰면서 나도 모르게 기훈을 포함한 등장인물을... 바보라 칭하지 않고 욕으로 남기고 싶은 마음이 들었다  ",598,2.0
watcha,오징어 게임 시즌 3,Squid Game Season 3,2025,나로,감독 역량을 적나라하게 보여주는 질적• 양적으로 조화되지 못한 플롯.  사공이 많으면 배가 산으로 간다더라.,60,2.0
watcha,오징어 게임 시즌 3,Squid Game Season 3,2025,일레인. [ Elaine. ],"돌고 돌아, 인간성과 가르침. 사람은.",21,0.5
watcha,오징어 게임 시즌 3,Squid Game Season 3,2025,noler,소소한 재미로 봄,9,0.5
watcha,오징어 게임 시즌 3,Squid Game Season 3,2025,위룡거거,으!!!!!!!너무 표독함!!!!!!!그냥 모든인물이 너무 표독해서 놀람 덜덜!!! 그리고 외국에서 쫌 떴다고 밥상 차려주는 장면에 한국의 미를 보여주는 음식 내놓는거 보고 분노 폭발!!그리고 아기가 무슨 알마냥 퐁하고 나오냐!! 젖주는 장면은 왜 넣어!!!!이정재가 우유 줬으면 미친부성애라도 느꼈음… 임시완 캐릭터는 뭐냐????!!!! 눈만 표독하게 뜨다가 갑자기 희생….그냥 제국의 아이돌로 돌아가!!,227,2.0
watcha,오징어 게임 시즌 3,Squid Game Season 3,2025,Soogemi,속편은 무리다,7,2.5
watcha,오징어 게임 시즌 3,Squid Game Season 3,2025,나나,지랄떤다,4,3.5
watcha,오징어 게임 시즌 3,Squid Game Season 3,2025,Aivy,이해 하지 못하겠는.. 인물들의 감정선들이 난무하니.. 꽤 충격적이고 흥미로웠던 드라마가.. 찝찝함만 남기고 끝나버렸다..,68,1.5
watcha,오징어 게임 시즌 3,Squid Game Season 3,2025,JHrock,미적지근한 결말.,9,3.0
watcha,오징어 게임 시즌 3,Squid Game Season 3,2025,가윤🐤,아기가 너무 AI였고 결말이 진짜 .. 별로다 ㅜ,27,3.0
watcha,오징어 게임 시즌 3,Squid Game Season 3,2025,이고,많은 걸 바라지 않았다.,13,2.0
watcha,오징어 게임 시즌 3,Squid Game Season 3,2025,조엘,시즌투 시작한 이상 어떻게 끝내든 욕먹게 될 예정이긴 했는데.. 마지막 신파는 찝찝했다.,49,1.0
watcha,오징어 게임 시즌 3,Squid Game Season 3,2025,ㄲㅅㅈ,게임만 해라 지루해 죽는 줄 알았네 위하준의 목적은 대체 므ㅓ여? 한국사람 의리로 봄,47,3.0
watcha,오징어 게임 시즌 3,Squid Game Season 3,2025,zero,"이죽일놈의 호기심,,, 유튜브에 요약본이나 볼껄,,",28,4.5
watcha,오징어 게임 시즌 3,Squid Game Season 3,2025,Fugalien,와 나 진짜 드럽게 재미없네 끝까지 억지로 보다가 죽는줄 아오 시간 아까워ㅓㅓㅓ,44,3.0
watcha,오징어 게임 시즌 3,Squid Game Season 3,2025,eun,노잼,2,2.0
watcha,오징어 게임 시즌 3,Squid Game Season 3,2025,조성민,금자와 부대장 죽음 등등 부자연스러운 전개 투성,26,2.5
watcha,오징어 게임 시즌 3,Squid Game Season 3,2025,공부노예,"인간은 비합리적이다. 그러기에, 우리는 인간을 믿는다…",30,2.5
watcha,오징어 게임 시즌 3,Squid Game Season 3,2025,나츠,어쩌다 이래 됐냐 오겜이,13,0.5
watcha,오징어 게임 시즌 3,Squid Game Season 3,2025,애태타,"갓난아기에게 서사를 넣으려고 억지 쓴 점, 맥락 다 끊는 지식의 별 스펀지 게스트를 쓴 점, 이병헌 캐스팅 해놓고 마스크 씌우고 목소리 변조해놔서 출연료 날려먹은 점, 사람은 말이 아니라면서 죽일 것 다 죽인 점 그러면서도 이게 마치 종교적 ‘희생’이라고 생각하고 촬영한 점..(본인 죄에 대한 속죄가 맞겠다.)",174,0.5
watcha,오징어 게임 시즌 3,Squid Game Season 3,2025,namh,team타노스 저는당신들을잊지않을것입니다,22,3.0
watcha,오징어 게임 시즌 3,Squid Game Season 3,2025,주관적으로,하고 싶은 말이 많은 건 알겠는데 아쉽다 그래도 2까지 봤으니 멈출 수도 없어 의리로 정주행 커진 스케일도 보이고 뒤로는 어떻게 되려나?,76,2.5
watcha,오징어 게임 시즌 3,Squid Game Season 3,2025,처르니,와 나 이거 도저히 끝까지못보겠네ㅋㅋ,20,0.5
watcha,오징어 게임 시즌 3,Squid Game Season 3,2025,강민수,이기적 생존인가? 이타적 공존인가?,19,2.5
watcha,오징어 게임 시즌 3,Squid Game Season 3,2025,MJ,이번 오징어 게임 우승자는 바로 오징어 게임 그 잡채입니다.,33,2.0
watcha,오징어 게임 시즌 3,Squid Game Season 3,2025,혜빈,시즌1에 전세계가 열광할 때도 나한텐 오락영화 그 이상도 이하도 아니었던지라… 회수되지 않은 떡밥들이 너무 많은 거랑 갓난아기를 죽이지 않을거라는 생각이 들어서 출산 이후로는 너무 뻔한 전개였다는 것 말고는 ㄱ찮았음. (2025.7)?,131,3.0
watcha,오징어 게임 시즌 3,Squid Game Season 3,2025,장빨,김이 팍 세는 마무리,11,3.5
watcha,오징어 게임 시즌 3,Squid Game Season 3,2025,RagingBull,케이트 블란쳇이라니...,13,2.5
watcha,오징어 게임 시즌 3,Squid Game Season 3,2025,김대겸,"홉스는 자연상태에서 인간은 이기적일 수밖에 없다고 봤다. 성기훈이란 캐릭터는 그와 반대되며 그 극단적인 비윤리적 세계 속에서 어떻게든 덕을 가지려 한다. 따라서 성기훈은 모순의 극치를 끝까지 유지했고, 감독은 그 행동을 숭고함으로 포장하기에 급급했다. 제일 문제는 설득력이 부족하다는 것이다. ""인간은 이기적인 세계에도 인간적으로 행동할 수 있다""라는 주장을 하기엔 너무 극단적인 세계를 창조했으며, 성기훈이란 캐릭터도 그 세계를 거스를 수 없기에 당연히 비인간적인 행동을 하게 되있다. 하지만 이 캐릭터는 특별해서, 주인공이라서 그런 짓은 용서되고 착해보여야 하니까 영웅 행동하게 하는 것은 캐릭터 붕괴에 가깝다고 느껴진다. 애초에 성기훈은 시즌1에서 찌질이 캐릭터 였는데 시즌2에서 완전히 바뀌어 버렸다. 정확히 말하자면 시즌1 마무리 부분에서 성기훈이 게임에 다시 참여한다는 것이 캐릭터 붕괴의 시발점일 것이다. 물론 성격이 바뀔 수 있지만 아까도 말했듯이 캐릭터 성격이 180도 바뀔 만한 설득력이 부족했으며, 시즌2에서 시작된 영웅놀이가 그대로 시즌3 끝까지 유지되는 것은 시청자 입장에선 고문이다. 게다가 아기를 시즌3에 등장시키는 과정, 그 결과를 구상하는 방식도 안이하며, 오히려 메시지를 모호하게 한다. 한마디로 이거도 저거도 아니라는 것이다. 극단적 설정을 했으면 극단적으로 나아가야 하는데 부담감 때문인지 자꾸 뒷걸음질 치는 것 같아 안타깝기만 하다. 마지막 장면도 어떻게 다듬을지 몰라 바톤 터치하는 모습 같다.",746,2.0
watcha,오징어 게임 시즌 3,Squid Game Season 3,2025,재이,케이트 블란쳇도 시즌 1만 알고 출연을 결정했을 거 아냐. 사과는 했어요?,41,3.5
watcha,오징어 게임 시즌 3,Squid Game Season 3,2025,서래,황형사의 도시어부,9,4.0
watcha,오징어 게임 시즌 3,Squid Game Season 3,2025,이밍둥망둥,임시완 없었으면 뭣도 아닌 드라마 솔직히 마지막 화는 임시완 원맨쇼,37,1.0
watcha,오징어 게임 시즌 3,Squid Game Season 3,2025,최은규,사람들이 너무 멍청해서 보는 나까지 점점 멍청해지는 것 같다,33,0.5
watcha,오징어 게임 시즌 3,Squid Game Season 3,2025,영주,넷플릭스가 2025년에 남긴 오점 1. 데블스 플랜 2 2. 이거,36,1.5
watcha,오징어 게임 시즌 3,Squid Game Season 3,2025,Arcturus,중간부터 이미 우승자는 정해졌고 이야기는 자꾸 곁다리로 빠진다,34,0.5
watcha,오징어 게임 시즌 3,Squid Game Season 3,2025,BIGO,와…… 이렇게 끝내는구나… 시즌2가 더 나았구나 싶다,29,1.0
watcha,오징어 게임 시즌 3,Squid Game Season 3,2025,그냥,"인물들의 어이 없는 선택과 이야기 전개가 좀 당황스럽긴하지만, 감독의 세상과 그 속의 인간군상을 아주 거지같이 보는 시선은 내 취향! 오징어 게임이 해피엔딩이면 오징어 게임이 아니다!",102,2.0
watcha,오징어 게임 시즌 3,Squid Game Season 3,2025,롤린스,온갖 혹평들 때문에 얼마나 나쁠지 기대하면서 봤다. 근데 그렇게 나쁘지 않다. 작가의 대부분의 선택들이 이해가 되고 전작들에 비해 크게 떨어진다는 생각은 들지 않는다.  근데 왜 이렇게까지 사람들은 실망했을까. 그냥 내가 다른 쪽으로 기대를 하고 봐서 그럴까.,145,2.0
watcha,오징어 게임 시즌 3,Squid Game Season 3,2025,jay,불필요한 서사,7,1.5
watcha,오징어 게임 시즌 3,Squid Game Season 3,2025,Tony,오징어도 오래 구우면 쪼그라든다.,18,3.0
watcha,오징어 게임 시즌 3,Squid Game Season 3,2025,김재혁,"빨씨 기훈이형에 대한 태도를 또렷하게 했으면 어땠을까. 영웅의 논리를 따르는 그를 끝까지 비웃었다면.  * 강하늘을 죽이려는 살의에 가득한 성기훈 표정, 손에 움켜쥔 마법요정 칼 씬이 제일 마음에 들었다.",114,2.5
watcha,오징어 게임 시즌 3,Squid Game Season 3,2025,Blueboxxx,국내 관객들에게는 너무나 익숙한 얼굴들이 가득하며 질리도록 본 신파였을 뿐이지만 해외 관객들에게는 신선했을 줄이야.  물론 개인적으로 이런 편집 기법과 미장셴들은 너무 인상 싶었다. 게다가 이 정도의 각본은 전혀 질이 떨어지지도 않았다고 본다.,136,3.5
watcha,오징어 게임 시즌 3,Squid Game Season 3,2025,만두맛집,임신출산 없으면 여성서사 못쓸듯,17,0.5
watcha,오징어 게임 시즌 3,Squid Game Season 3,2025,신성범,임시완이 해주는구나..,12,2.5
watcha,오징어 게임 시즌 3,Squid Game Season 3,2025,tokki_soo,본격 신파게임,7,3.0
watcha,오징어 게임 시즌 3,Squid Game Season 3,2025,도롱도롱뇽뇽,너무 잘 됐다 실력에 비해,14,3.0
watcha,오징어 게임 시즌 3,Squid Game Season 3,2025,이승빈,"""왜 죽임? 왜 살림? 왜 희생함? 왜 저럼?"" 시청자마저도 당연히 할 수 있는 질문들에 절대 대답하지 않는다. 뻔한 충고만 소리치고 끝난다. 마지막까지 질문하는 건 시청자. ""그래서 누구한테 하는 소린데?""  고민의 흔적이 느껴지지 않는 창작물은 힘을 가질 수가 없다.",151,4.0
watcha,오징어 게임 시즌 3,Squid Game Season 3,2025,김정모,의미는 퇴색되고 과정들은 이해가지 않는 그저 살인게임,29,0.5
watcha,오징어 게임 시즌 3,Squid Game Season 3,2025,허윤영,참신함과 속도감 같은 장점은 다 버리고 무거운 생각만 남은 망작.,36,1.5
watcha,오징어 게임 시즌 3,Squid Game Season 3,2025,시후,이건 정답이 아니야…,11,2.5
watcha,오징어 게임 시즌 3,Squid Game Season 3,2025,nowhere,"이러니 저러니 해도 도가니에서 수상한 그녀, 남한산성 갔다가 오징어게임으로 가는 황동혁 감독은 대단하다.",58,1.0
watcha,오징어 게임 시즌 3,Squid Game Season 3,2025,SOOO,난 생각보단 괜찮은데 ..ㅎ 그냥 아뮤생각없이 킬링타임으로 보면 ㄱㅊ음 근데 왜? 라고 생각하기 시작하면 이상함 모든주제의식이 모성애 새로운생명 희망을 위한 찬양으로 가득찼고 황형사는 두시즌내내 바다에서만 돌아다님 성기훈은 걍 .. 원래 좀 그러니까 .. 납득,145,1.5
watcha,오징어 게임 시즌 3,Squid Game Season 3,2025,짱짱짱,사람이야!! 말이 아니야!! 20250712 play Netflix,37,0.5
watcha,오징어 게임 시즌 3,Squid Game Season 3,2025,김세희,시즌1은 그나마 캐릭터들 이해도 가고 그냥 한국형 신파구나 했지만 시즌2는 사연수집가 (여기부터 문제지 다 때려박으려니) 시즌3는 엄마가 이해가 가냐?? 누구하나 이해가 안간다ㅋㅋㅋ,101,0.5
watcha,오징어 게임 시즌 3,Squid Game Season 3,2025,나옹,"이러다 다~~죽어~~~~~ㅆ 네. 기훈이형 왜그랬어  그래도 시즌1 무궁화 꽃이 피었습니다의 충격적인 시작과 강렬함, 숱한 게임을 통한 몰입감을 잊을 수 없기에... 전세계 1위 시청,화제성,다양한 이슈,기록들을 감안하며...",126,0.5
watcha,오징어 게임 시즌 3,Squid Game Season 3,2025,참신한소재어디,이전에 봤던 정이 있어서라도 시즌 3은 끝까지 보고싶었다. 내가 보기엔 잔인한 부분이 많았고 스토리는 결국 이전 시즌들과 말하고자 하는 건 비슷했다. 오징어게임 리메이크판도 결국 볼 듯. 세계관이 이어질지 궁금하다.  넷플릭스,126,0.5
watcha,오징어 게임 시즌 3,Squid Game Season 3,2025,YeokyeongKim,뭐 공감안되는 부분은 몇 있었지만 그냥저냥 볼만했던?? 근데 시즌 2 3 왜 나눴는진 잘 모르겟네,54,2.5
watcha,오징어 게임 시즌 3,Squid Game Season 3,2025,전정혜,"돈이 빨리고 집이 빨리고 가족이 빨리고 사랑이 빨리고 이 모든 걸 저지른 몸마저  빨리면 뭐가 대체 남길레...  만에 하나 뭔가 남았다면 그건 '사랑과 영혼' (Ghost 1990) 마저 '말'로 만들 정도의 숭고라도 되는 걸까 신이 죽은 세상에서, 그 숭고는 무엇이 만들길레.  생각건대 그것은 믿음도 약속도 희망도 기원도 아니다. 성기훈의 비이성과 모순보다 혼돈스럽게 마지막까지 존재하는 건 이성적으로 생각하건대 그것은 거짓이다.  사랑까지가 진짜다. 벼랑끝에서 아른 거리는 건 (민수의 환각처럼) 존재가 아니다.  숭고는 '말'이 아닌 거짓으로 잉태한다. 피보다 새빨간 거짓으로 존재한 적도 없이 태초에 존재했던 것인냥.  인간은 '말'을 배우기 전에 거짓을 배웠다.  아직 무존재라 할 지언정 거짓으로나마 남기 위하여.  언젠가 나도 때가 되면 그렇게  말하고 싶다.  나는 말이 아니야  *  시즌 2는 딱 작품의 과녁인 자본주의적 논리로 늘어뜨린  엉성한 인트로덕션이었지만 3을 보니 모든 게 납득 되었다. 맛없는 반찬은 2에다 쟁여놓고 메인 메뉴만 남겨 놓은 3으로 평가 받고 싶던 것이다.  시즌 1 - 3.5/5 오징어처럼 말려주는 게임  시즌 2 - 1.5/5 씹다 버린 폐기물 오징어  시즌 3 - 4.5/5 영혼까지 쭉 빨린 오징어  세편 다 신기하게 잘 오지 않는 해피 타임에 찾아왔다. 오래 기억될 작품이다.",691,1.5
watcha,오징어 게임 시즌 3,Squid Game Season 3,2025,소피,애기를 뭐하러 넣은건지 참..,16,1.5
watcha,오징어 게임 시즌 3,Squid Game Season 3,2025,차상현,"무의미한 분량늘리기 없이 시즌 2, 3 합쳐서 하나의 시즌으로 냈다면 그나마 나았을텐데...",51,2.0
watcha,오징어 게임 시즌 3,Squid Game Season 3,2025,김치,임시완의 재발견 그리고 아기,15,2.0
watcha,오징어 게임 시즌 3,Squid Game Season 3,2025,이승보,아무것도 남은 게 없다ㅜ,13,3.0
watcha,오징어 게임 시즌 3,Squid Game Season 3,2025,박시원,딱히 할 말이 없다면 있는 척 할 필요 없다,24,3.0
watcha,오징어 게임 시즌 3,Squid Game Season 3,2025,rose 1207,이거볼려고 넷플 끊으셨다면 반건조 오징어나 구워드십쇼,29,3.0
watcha,오징어 게임 시즌 3,Squid Game Season 3,2025,킴독독,집에서반건조오징어먹는게더생산적일듯,18,0.5
watcha,오징어 게임 시즌 3,Squid Game Season 3,2025,nakki,아 국적통와 창피해,10,3.0
watcha,오징어 게임 시즌 3,Squid Game Season 3,2025,azukipanda,왜 마이너스 별점은 줄 수 없는거지,19,2.5
watcha,오징어 게임 시즌 3,Squid Game Season 3,2025,뇨니,"1~2화. 아니 즌2에 이어서 즌3에서도 성기훈 대체? 하게 됨ㅋㅋㅋㅋㅋㅋㅋㅋㅋㅋㅋ  3~4화. 성기훈 각성에 대체 몇개의 캐릭터가 희생되는건지… 주인공을 위한 역할만 수행하는 캐릭터는 매력도 생명력고 잃고만다는 것을 감독님들은 언제 알까! 게임 구성은 여전히 나쁘지 않지만, 숨바꼭질은 너무 밸붕이다ㅎ(근데 또 단검 굿즈는 약간 탐난다)  최종화까지 다 봄. 으휴… 성기훈 각성할 때부터 예상했던 결말이 그대로 컨텐츠만 남은 시리즈.. 의리로 다 봤다..",255,0.5
watcha,오징어 게임 시즌 3,Squid Game Season 3,2025,뒤베르제,"사람의 존엄과 희망을 낙관하려는 의도가 엿보이나, 정확히 반대되는 연출과 극본. 그 말인즉슨 총체적 악.",58,2.0
watcha,오징어 게임 시즌 3,Squid Game Season 3,2025,maree,캐릭터를 그렇게 활용할거면 뭣하러… 시즌 3까지 끌었냐.,31,2.5
watcha,오징어 게임 시즌 3,Squid Game Season 3,2025,조창환,그렇게 다 보내야 했냐,12,1.5
watcha,오징어 게임 시즌 3,Squid Game Season 3,2025,이비즘,남한산성 찍던 황동혁이 맞냐 진짜 이야기도 만듦새도 다 대충대충 참,37,3.0
watcha,오징어 게임 시즌 3,Squid Game Season 3,2025,TW,더 이상 성기훈을 포함한 누군가의 생존 여부가 궁금하지 않아졌다.,36,2.5
watcha,오징어 게임 시즌 3,Squid Game Season 3,2025,임희성,나름 아름답게 마무리하려고 노력한 게 느껴지지만...,29,1.5
