site,title,title_en,year,reviewer,review,review_length,rating
watcha,이상한 변호사 우영우,Extraordinary Attorney Woo,2022,Mer,박은빈,3,4.0
watcha,이상한 변호사 우영우,Extraordinary Attorney Woo,2022,Lina,이 드라마로 박은빈 배우를 알게 됐다,20,4.5
watcha,이상한 변호사 우영우,Extraordinary Attorney Woo,2022,표표,매회가 기다려지긴 했지만 너무 똑같은 플로우라.. 역시 막판엔 약간 힘 풀림,42,4.0
watcha,이상한 변호사 우영우,Extraordinary Attorney Woo,2022,복돌,2화까지는 5점 짜리였다,13,3.0
watcha,이상한 변호사 우영우,Extraordinary Attorney Woo,2022,백브로,"뻔할 거 같아서 일부러 천천히 봤는데, 뻔하게도 마음이 따뜻해져 버렸네.",40,4.0
watcha,이상한 변호사 우영우,Extraordinary Attorney Woo,2022,한상유,요즘 변호사랑 교도관 드라마가 많이 보이네,23,4.0
watcha,이상한 변호사 우영우,Extraordinary Attorney Woo,2022,지금이게맞아?,중반 이후로는 영우보려고 본 느낌.,19,3.5
watcha,이상한 변호사 우영우,Extraordinary Attorney Woo,2022,현재속의우울,너무 밸런스를 잘 맞춘 법정 옴니버스 판타지 동화,27,4.5
watcha,이상한 변호사 우영우,Extraordinary Attorney Woo,2022,지원,캐릭터 하나하나 정말 사랑스럽게 본 드라마,23,4.5
watcha,이상한 변호사 우영우,Extraordinary Attorney Woo,2022,스마윌,샛길로 빠지지 않았더라면 더 좋았을 드라마,23,3.0
watcha,이상한 변호사 우영우,Extraordinary Attorney Woo,2022,또내,쪼금 용두사미... 빵구 나오기 전까지 한회한회 너무 소중했다,34,3.5
watcha,이상한 변호사 우영우,Extraordinary Attorney Woo,2022,김머시기,중반까지는 정말 재미있었는데...,18,3.5
watcha,이상한 변호사 우영우,Extraordinary Attorney Woo,2022,장슬기,따뜻해,3,4.0
watcha,이상한 변호사 우영우,Extraordinary Attorney Woo,2022,jh,이상한변호사 우영우 이상한 작가 문지원,21,4.0
watcha,이상한 변호사 우영우,Extraordinary Attorney Woo,2022,곧갬,"최수연의 바보같은 선함을, 권민우의 인간성 회복의 가능성을, 정명석의 합리적인 리더십을, 평범한 사람들의 사소한 인간성을 새삼 발견시켜주는 우영우라는 리트머스지",89,1.5
watcha,이상한 변호사 우영우,Extraordinary Attorney Woo,2022,YeongSeobLee,살풋 기우는 게 이야기인지 카메라인지 내 맘인지...,29,1.0
watcha,이상한 변호사 우영우,Extraordinary Attorney Woo,2022,서은빈,초반이 너무나 재밌었던,12,2.5
watcha,이상한 변호사 우영우,Extraordinary Attorney Woo,2022,선블리♡,22.7.19~10.10  초반이 가장 재미남 두번봐도 재밌었음 사건+감동+로맨스가 좋아서 만점 좋은대사도 많아서 감동적이고 동그라미덕에 많이 웃는다  중후반은 스토리가 지루하면 폰하면서봄  캐릭터들은 너무 좋고 재밌음  마지막회 너무 훈훈하다 해피엔딩체고..♡,146,3.5
watcha,이상한 변호사 우영우,Extraordinary Attorney Woo,2022,피카레스크,용두사사사가사ㅏ사사미,11,2.0
watcha,이상한 변호사 우영우,Extraordinary Attorney Woo,2022,왈왈이시드,진짜최악의쓰레기,8,3.5
watcha,이상한 변호사 우영우,Extraordinary Attorney Woo,2022,박상율,대게 감동 드라마의 끝은 이렇더라,18,3.5
watcha,이상한 변호사 우영우,Extraordinary Attorney Woo,2022,어깨이넘,스토리. 연기. 연출. 뭐하나 빠지는 것이 없는 명작,29,3.0
watcha,이상한 변호사 우영우,Extraordinary Attorney Woo,2022,버벌유진트,이거 보고 방문앞에서 손가락으로 3초 셈,22,3.0
watcha,이상한 변호사 우영우,Extraordinary Attorney Woo,2022,google,깔끔한 인상,6,3.5
watcha,이상한 변호사 우영우,Extraordinary Attorney Woo,2022,인터넷닷컴,박은빈 짱,5,5.0
watcha,이상한 변호사 우영우,Extraordinary Attorney Woo,2022,YeokyeongKim,막 재밌다 이런거까진 모르겠지만 뭔가 매 화마다 우영우의 멘트나 상황들이 많은걸 느끼게 해주고 공감도 가서 좋았(?)다,66,4.0
watcha,이상한 변호사 우영우,Extraordinary Attorney Woo,2022,웅파치노,매력적인 케릭터들로 무거운 주제들을 의미있고 유쾌하게 풀어가는 점이 좋았던 작품.,45,4.0
watcha,이상한 변호사 우영우,Extraordinary Attorney Woo,2022,이유찬,신선한 캐릭터와 새로운 이야기거리를 가져와서 만든 유치하고 뻔한 이야기.  왜이렇게 쓸데없는 이야기가 많은지..,62,3.5
watcha,이상한 변호사 우영우,Extraordinary Attorney Woo,2022,Preline,초반은 진짜 신선하고 재밌었는데 갈수록 극에 로맨스 뿌리기 느낌이 있어서 조금 아쉬웠던.. 새로운 장르의 발견에서 뻔한 장르로의 변신같아 아쉬웠다 그래도 특유의 풋풋함이 있어 나름 괜찮게 봤다 나는 역시 에피소드형을 좀 좋아하는 듯,129,3.5
watcha,이상한 변호사 우영우,Extraordinary Attorney Woo,2022,보라빛시청,진짜 이상한 건 무엇일까?,14,1.0
watcha,이상한 변호사 우영우,Extraordinary Attorney Woo,2022,WATJUA pedia,드라마의 새로운시도 결과는 아주 성공적이었다.. 생각하고 만든 드라마가 이런건가라고 생각하게 만들어준 드라마,60,3.0
watcha,이상한 변호사 우영우,Extraordinary Attorney Woo,2022,전형준,다 좋은데 그 갑자기 머 깨닫는 일멍 고래씬... 너무 역겨움... 그만 나왓으면...,48,3.0
watcha,이상한 변호사 우영우,Extraordinary Attorney Woo,2022,임지희,기러기 토마토 스위스 인도인 별똥별 우영우,23,4.0
watcha,이상한 변호사 우영우,Extraordinary Attorney Woo,2022,송송,우 투더 영 투더 우,11,2.0
watcha,이상한 변호사 우영우,Extraordinary Attorney Woo,2022,육현준,어두울뻔하다가 유턴 우영우 엄마 클로즈업 할때 화면 흔들리는 연출 좋음,39,5.0
watcha,이상한 변호사 우영우,Extraordinary Attorney Woo,2022,hyun,영우야 계속 뿌듯하렴,11,4.0
watcha,이상한 변호사 우영우,Extraordinary Attorney Woo,2022,ifyoureoverme,그 맑은 눈으로 나를 바라보지 말아요 나는 아마 당신을 실망시킬 거에요 우린 주변에 맴도는 것으로 만족해야 할 거에요 그래도 괜찮다면 친구할까요 옆에서 함께 살아갈까요,93,4.0
watcha,이상한 변호사 우영우,Extraordinary Attorney Woo,2022,진우영우,자폐의 변호자 자폐의 생활 등을 보여주는 것에서는 리얼하고 좋게 봤지만 이야기성으로는 만점 주기가 너무 아깝다. 이야기가 중간이 아예 없는 것 같고 아직 보다만 느낌이다.,95,2.5
watcha,이상한 변호사 우영우,Extraordinary Attorney Woo,2022,박희선,우영우 그 자체만으로,11,1.5
watcha,이상한 변호사 우영우,Extraordinary Attorney Woo,2022,폭렬여대생,첫화보고 깜짝놀랐던 기억 훌륭합니다,19,3.0
watcha,이상한 변호사 우영우,Extraordinary Attorney Woo,2022,홍마초,기승전 K로멘스,8,3.5
watcha,이상한 변호사 우영우,Extraordinary Attorney Woo,2022,hong,논란이 있더라도 유기농같은 드라마,18,3.5
watcha,이상한 변호사 우영우,Extraordinary Attorney Woo,2022,푸릇한배추,조연 캐릭터 인물 설정이 과하게 단순하다. 편안하게 볼 수 있어 좋았다면 다소 흥미는 떨어진다.,53,1.5
watcha,이상한 변호사 우영우,Extraordinary Attorney Woo,2022,김수정,10화 빼고 전반적으로 재밌게 봄,18,4.0
watcha,이상한 변호사 우영우,Extraordinary Attorney Woo,2022,소라,기대 이상.,6,3.5
watcha,이상한 변호사 우영우,Extraordinary Attorney Woo,2022,korea_cinephile,"어떻게 이럴 수 있을까 용두사미의 작품, 작가의 상상력은 작품을 보는 도중 전개를 예측하는 나조차도 못 이긴단 말인가",65,3.5
watcha,이상한 변호사 우영우,Extraordinary Attorney Woo,2022,개장군,펭수 장면 말고 딱히 볼게 없다,17,4.0
watcha,이상한 변호사 우영우,Extraordinary Attorney Woo,2022,오윤오,갈수록 영,5,2.5
watcha,이상한 변호사 우영우,Extraordinary Attorney Woo,2022,박성진,"장애인, 특히 자폐 스펙트럼의 인식을 긍정적으로 바꾸고자 하는 취지는 좋지만 논란이 되는 데에도 이유가 있는 듯 하다. 에피소드 형식이라 짧게 몰입할 수 있고 피로도가 떨어지며, 매 에피소드마다 사회적으로 작가가 전달하고자 하는 긍정적인 메세지가 분명해서 뭔가 보고 나면 더불어 사는 세상을 만들고 싶고, 희망차지긴 한다. 그러나 스토리 면에서 봤을 때 분위기는 아기자기하지만 잘 들여다보면 막장 스멜이 풍기고, 호흡을 짧게 가져가다 보니 사랑이나 출생의 비밀 등 주인공을 뒷받침하는 요소는 거들 뿐이라 스토리 위주로 보는 사람들은 아쉬웠을 듯.",305,4.5
watcha,이상한 변호사 우영우,Extraordinary Attorney Woo,2022,해바라기,"재미있는 법정드라마를 기대하고 봤는데,10화정도까지보니,법정사건은 아주 간단한 사건들이고,로맨스,출생의 비밀까지 너무 많은 분량을 차지하다보니,어쨌든 저랑은 안 맞는 드라마였다",98,5.0
watcha,이상한 변호사 우영우,Extraordinary Attorney Woo,2022,글락,"가족이란 온실을 떠나 세상에 부딪히는 천재 장애인 변호사의 아프기도 하지만, 따뜻한 이야기.",51,4.0
watcha,이상한 변호사 우영우,Extraordinary Attorney Woo,2022,여남옵,아쉬워..아쉽다..,10,4.5
watcha,이상한 변호사 우영우,Extraordinary Attorney Woo,2022,최소원,기대 안 하고 보면 재밌을 드라마,18,3.0
watcha,이상한 변호사 우영우,Extraordinary Attorney Woo,2022,호박,용두사미. 제주도에 그라미랑 이자카야 사장님이 왜 따라감? 법정에서 왜 갑자기 극적으로 쓰러짐? 왜 다같이 쓰러진 변호사의 추억의 맛집 찾으러다님?,82,5.0
watcha,이상한 변호사 우영우,Extraordinary Attorney Woo,2022,KK,"답이 이미 정해져 있는 세상에서 나만의 답을 내놓는 것. 강자는 약자가, 약자는 강자가 되고 앞을 보지 못하는 자는 옆을 보고, 이원론에서 벗어나 그 너머를 본다.  문화의 힘이 정말 크구나를 새삼 또 느낀다. 삼투 작용, 내가 몰랐던 또 다른 세계관이 독립된 나의 세계관에 들어오는 것. 성장, 이전으로 돌아갈 수 없고, 화합, 융화, 침식, 침잠, 잠식, 동화, 이해, 공감… 무엇으로 표현해야 할지는 아직 잘 모르겠다.  그리고 27살의 나는 지금, 이상하고 별나지만, 뿌듯함을 느끼고 있다.",278,4.0
watcha,이상한 변호사 우영우,Extraordinary Attorney Woo,2022,수문,이상한 세계에 뚝하고 떨어진 모든 외뿔고래들이 결국엔 뿌듯하고 행복해지기를 바라며,45,3.5
watcha,이상한 변호사 우영우,Extraordinary Attorney Woo,2022,강준혁,2022.09.22.,11,4.5
watcha,이상한 변호사 우영우,Extraordinary Attorney Woo,2022,미니,후반부에 힘이 확 빠지지만 재밌음! 사건 하나하나도 흥미롭다,33,4.5
watcha,이상한 변호사 우영우,Extraordinary Attorney Woo,2022,👁👄👁,소재도 신선하고 흥미돋게 보긴했는데 변호사 법정물은 나랑 안맞는듯 ㅠㅠ 보다 하차,45,4.5
watcha,이상한 변호사 우영우,Extraordinary Attorney Woo,2022,강왕선,갈수록 우영우 외의 이야기로 빠지는..,21,4.0
watcha,이상한 변호사 우영우,Extraordinary Attorney Woo,2022,현정정현정,참신한 소재였으나 역시나 주인공이 모든걸 해결해버리지,29,4.5
watcha,이상한 변호사 우영우,Extraordinary Attorney Woo,2022,김주람,도덕적으로 어려운 주제에 다가갈수록 작가의 역량부족이 여실히 드러난다. 처음에 재미있게 보다가 하차.,56,5.0
watcha,이상한 변호사 우영우,Extraordinary Attorney Woo,2022,이재준,용두사미....,8,4.0
watcha,이상한 변호사 우영우,Extraordinary Attorney Woo,2022,펭소귄정,"장애인에 대한 사회구조적 문제를 관계적 문제로 축소시킨다는 점에서 불편했음. 그래서 신경다양인에 대한 논의를 수면 위로 끌어올리기에는 주인공이 자폐인이라는 설정이 너무 간편하고 소비적이었다는 생각도 들고. 너무 이런저런 이야기를 다 담으려고 했다는 생각도 들고. 그래도 자폐인의 행동 특성에 대한 관찰과 묘사가 제법 섬세했다고 생각되기도 하고, 무엇보다 재미가 있었음. 개인적으로 박은빈 배우 딕션이 너무 좋아서 편-안",234,4.5
watcha,이상한 변호사 우영우,Extraordinary Attorney Woo,2022,Thomas Kim,"초반엔 너무 재미있었는데 후반부로 갈수록 캐릭터, 스토리가 실망스러움...굿닥터는 끝까지 재미있었는데... 그래도 박은빈이 귀여워서 끝까지 봤다.",81,3.0
watcha,이상한 변호사 우영우,Extraordinary Attorney Woo,2022,김대용,"처음엔 큰 집중 없이 편하게 볼 수 있어 좋았지만 옵니버스식으로 한편, 혹은 두편으로 사건하나 해결해가면서 큰 줄기의 이야기를 천천히 전개하는게 나한테는 좀 루즈했다. 결국 10화에서 하차..",107,4.5
watcha,이상한 변호사 우영우,Extraordinary Attorney Woo,2022,민들레날리,대다수의 공감을 얻은 작품을 오글거리다고 느끼는 나.. 드디어 홍대병에 걸린걸까,44,3.5
watcha,이상한 변호사 우영우,Extraordinary Attorney Woo,2022,채린,오랜만에 본 정말 따뜻했던 드라마,18,4.0
watcha,이상한 변호사 우영우,Extraordinary Attorney Woo,2022,¯ࡇ¯,단연코 올해의 드라마,11,4.0
watcha,이상한 변호사 우영우,Extraordinary Attorney Woo,2022,현재,갈수록 뭔가 아쉬워. 근데 그 뭔가가 뭔지 잘 모르겠다. 마지막화까지도 마지막화 답지 않은 임팩트… 그래서 끝난거 맞지?,67,4.5
watcha,이상한 변호사 우영우,Extraordinary Attorney Woo,2022,Jeong Joon Oh,예쁜드라마지만 흐지부지한 스토리진행과  정보수집이 부족한듯한 아쉬운 드라마,41,4.5
watcha,이상한 변호사 우영우,Extraordinary Attorney Woo,2022,YSL,전형적인 용두사미 K-드라마,15,4.0
watcha,이상한 변호사 우영우,Extraordinary Attorney Woo,2022,썸머,기발하게 사건을 풀어나가는 재미 달달한 키스신,25,4.0
watcha,이상한 변호사 우영우,Extraordinary Attorney Woo,2022,박태현,"전반부는 최고. 8화 이후 장르가 애매지고서는 그저 결말이 궁금해서 마지못해 봤는데, 마지막화는 그래도 꽤 좋았다.",64,2.0
watcha,이상한 변호사 우영우,Extraordinary Attorney Woo,2022,장지방,한 6회까지였나까지 매우만족 그 뒤로 뒷심부족  점점 억지로 가득했다.,39,3.0
watcha,이상한 변호사 우영우,Extraordinary Attorney Woo,2022,허씨,"오만한 선민의식을 교묘하게 가려낸 판타지 of 판타지.  일시적인 재미를 위해 약자의 지위와 처지마저 수단으로 활용할뿐, 정작 그들의 엄연한 현실에 어떠한 변화도 가져다 주지 못한다.",102,3.5
watcha,이상한 변호사 우영우,Extraordinary Attorney Woo,2022,ㅅㅇ,캐릭터들의 매력으로 달려가던 드라마가 무슨 일인지 순간 갈피를 못 잡는다,40,3.0
watcha,이상한 변호사 우영우,Extraordinary Attorney Woo,2022,따비,"사람들의 큰 기대를 듣고 접하게된 작품  처음 높은 기대치로 시작했지만 점점 실망하게 되어 점수가 높지는 못하게 되었다  컨셉과 박은빈의 연기, 생각과 다르게 나아가는 스토리들이 큰 재미를 주었지만 웹툰 베이스여서 그랬을까... 너무나도 판타지적인 모습의 법정과 변호사, 그리고 일차원적인 털보와 동그라미의 모습이  작품의 몰입을 방해하였다  우영우 변호사가 주인공인 이유는 자폐변호사로 겪는 상황과 이야기를 보여주기 위함일텐데 이는 일정이상의 현실성을 기본으로 필요로 함에 있다. 가상성이 너무 높다면 그건 자폐가 아닌 새로운 장애나 질병일 수 있기 때문이다. 결국 우영우의 모습과 배경은 너무 현실과 동떨어지지 않아야 우리가 그 모습을 보고 장애에 대한 시선, 극복하는 모습 등을 느낄 수 있을텐데 이 작품은 현실성이 많이 부족하다.  하지만 현실성을 제외하고 자폐장애에 대해 모두가 불편함없이 접할 수 있게 킬링타임으로 괜찮은 작품이기도 하다",474,4.0
watcha,이상한 변호사 우영우,Extraordinary Attorney Woo,2022,동언,"흥미로운 캐릭터의 소재와 가려운 곳을 긁어주는 스토리가 좋았다. 주인공 캐릭터 뿐 아니라 각각의 개성있는 조연 덕분에 뻔하게 흘러갈 이야기에 감초가 되었다. 하지만 후반으로 치닫으며 영우와 준호의 사랑에 초점이 과도하게 맞춰진 경향이 없지 않게 있으며 그로 인해 법정에서 다뤄지는 이야기에 비중이 줄어들었다. 때문에 후반부의 매력이 떨어져 다음이 궁금하지 않게 되었다. 처음엔 매주 다음번의 이야기가 기다려질 정도로 흥미가 있었으나 갈수록 손이 잘 안 갔던 드라마. 흥미있는 소재, 답답하지 않은 전개, 아쉬운 결말.",289,4.0
watcha,이상한 변호사 우영우,Extraordinary Attorney Woo,2022,관리자,오랜만에 본방 챙겨본 드라마 매회 사건이 해결돼는게 좋았음,32,4.0
watcha,이상한 변호사 우영우,Extraordinary Attorney Woo,2022,양중석,초반부는 재밌는데 중반부터 막장드라마 테크,23,0.5
watcha,이상한 변호사 우영우,Extraordinary Attorney Woo,2022,빈블리,"에피소드 형식이라 뒤로 갈수록 지루해지는 것도 있었지만, 우영우라는 캐릭터가 이끄는 힘이 정말 크다.",56,4.0
watcha,이상한 변호사 우영우,Extraordinary Attorney Woo,2022,또용,매 화 감동적이고 생각할 점을 준 드라마!,23,4.0
watcha,이상한 변호사 우영우,Extraordinary Attorney Woo,2022,배키,누가 뭐래도 최고의 드라마였어,16,2.5
watcha,이상한 변호사 우영우,Extraordinary Attorney Woo,2022,Kimmy_p_q,"첫화부터 재밌게 본 드라마로, 대중의 관심이 높아지는게 신기했던 드라마.  충분히 상황과 캐릭터를 고려한 스토리와 플롯이 좋았고, 배우들의 연기합도 완벽에 가까울 정도로 좋았습니다.  전체적으로 플롯이 일본 드라마같다는 생각 느낌에 익숙함을 느꼈다.",139,4.0
watcha,이상한 변호사 우영우,Extraordinary Attorney Woo,2022,김재원,깊이감 있는 법정드라마로 시작해서 깊이감 없는 휴먼드라마로 마무리.,37,3.0
watcha,이상한 변호사 우영우,Extraordinary Attorney Woo,2022,최유진,자폐에대한 선입견이 사라지고... 조금은 이해할수 있을것 같다... 일단... 자폐... 법... 가정사... 어두운 소재로 정말 밝게 연출해서... 좋은 드라마인것같다...,97,4.5
watcha,이상한 변호사 우영우,Extraordinary Attorney Woo,2022,유자차에 휘핑크림,자폐인도 누군가에게는 사랑스러워 보인다. 그 사랑스러움을 잘 표현한 드라마라서 좋은 반면 사회가 자폐인을 대하는 태도는 달라지지 않은 것만 같다.,81,4.0
watcha,이상한 변호사 우영우,Extraordinary Attorney Woo,2022,따홍남,초반부분만큼의 힘은 떨어졌으나 충분히 매력적인 드라마,29,3.0
watcha,이상한 변호사 우영우,Extraordinary Attorney Woo,2022,채니,이상하고 별나지만 가치있고 아름다운 인생. 바보처럼 살아보는 것.  평이 갈릴 수 밖에 없는 드라마지만 이 드라마의 따뜻함이 참 좋다,74,2.0
watcha,이상한 변호사 우영우,Extraordinary Attorney Woo,2022,이지,법정물로서도 너무 재밌고 영우의 성장물로서도 너무 재밌었다!! 러브라인에 대해 말이 많았는데 난 주인공의 성장을 생각한다면 꼭 필요했던 요소라고 생각한다 다른 드라마들은 그냥 재밌어서 봤다면 우영우는 처음엔 재밌어서 봤지만 여기서 그치지 않고 사회의 다양한 문제들을 생각해볼 수 있는 계기가 됐던 것 같아 더욱 의미있었다 조금 아쉬운 부분도 있었지만 내 최애 드라마가 된건 확실하당,213,4.5
watcha,이상한 변호사 우영우,Extraordinary Attorney Woo,2022,한녹빵,일드보는거같음,7,4.0
watcha,이상한 변호사 우영우,Extraordinary Attorney Woo,2022,mmeyoung,정명석과 최수연 그리고 섭섭이 때문에 내내 마음이 따뜻하지 않았을까? + 동그라미 그리고 사장님도!,55,3.5
watcha,이상한 변호사 우영우,Extraordinary Attorney Woo,2022,김동식,220818 올레티비,11,5.0
watcha,이상한 변호사 우영우,Extraordinary Attorney Woo,2022,orangesong,기분좋은 드라마 회차에 따라 재미없는 회차도 있지만 전체적으로 밝고 즐거웠다,42,3.0
watcha,이상한 변호사 우영우,Extraordinary Attorney Woo,2022,제러미베러미,초반의 재미와 캐릭터의 매력이 후반으러 가면서 점점 사그라든다 이럴거면 11화에서 끝냈어야지 특히 마지막화는 끔찍하다 뭔가를 정리하려는데 그게 더 드라마를 난잡하고 지루하게 만든다 재미없어서 몇 번에 나눠봤다,116,5.0
watcha,이상한 변호사 우영우,Extraordinary Attorney Woo,2022,담쁘,착한 드라마,6,3.5
watcha,이상한 변호사 우영우,Extraordinary Attorney Woo,2022,이준현,"법정, 변호사 주제라는 다소 지겨울법한 소재임에도 스토리를 흥미롭게 이어감. 박은빈이라는 배우가 비로소 빛을 보고  만인이 좋아하는 배우가 된 것 같음. 끝으로 갈수록 너무 일반사람같은 자폐 변호사 설정의 정체성, 늘어지는 전개, 스토리에 대한 여러 논란은 결점",146,2.0
watcha,이상한 변호사 우영우,Extraordinary Attorney Woo,2022,진석,제주도 편이 기억에 남는다. 죽음이라는 주제를 다루어서 이다.,34,3.5
watcha,이상한 변호사 우영우,Extraordinary Attorney Woo,2022,Qkhauo,초반에 새롭던 설정들이 후반에 변색되어 힘을 잃어간다.,30,2.5
watcha,이상한 변호사 우영우,Extraordinary Attorney Woo,2022,네이밍,따뜻한 세상을 꿈꾸는 작가가 던지는 화두. 모든 에피소드가 다 공감되었다고 말할 순 없지만 의견을 나눌 수 있는 장을 만들었다는 것 그것 하나만으로도 굉장히 가치있는 드라마라고 생각한다.,104,4.0
watcha,이상한 변호사 우영우,Extraordinary Attorney Woo,2022,누구누구누구,"성소수자, 장애인, 어린이, 노인을 대변해서 변호하는 이야기는 언제나 환영",41,4.0
watcha,이상한 변호사 우영우,Extraordinary Attorney Woo,2022,천사지인,"- 자폐를 가진 한 변호사의 이야기. 옴니버스식 구성에 각 에피소드마다 한번쯤은 생각해볼만 굵직한 사건을 다룬다.  - 배우 박은빈님의 자폐 연기는 ""자연스러움"" 보다는 ""귀여움""에 초점을 맞춘 것 같아 보인다. 매력적이고 창의로운 자폐 연기이다. 12화 상대 변호사 역을 맡은 배우 이봉련님의 활기있는 연기가 여유 있고 인상적이다. 발성이 좋고 높낮이가 다채로워 흡입력이 있다. 정명석 변호사 역을 맡은 배우 강기역 님은 매우 이상적인 보스이자 좋은 사람으로 나오는데 현실에도 이런 사람이 존재하나 싶을 정도로 존경스럽고 배우고 싶은 인간상이다. 이 드라마에서 ""공감""을 가장 잘 해주는 인물은 정명석 변호사이다.  - 우영우가 속한 대형 로펌 한바다의 변호 전략은 이성보다는 감성과 낭만에 치우쳐서 억지 변호를 한다는 느낌을 받았다. 각 에피소드 사건마다 변호에 이기고 지냐의 문제보다는 공감의 측면에서 중점적으로 다뤄서 질리지는 않고 오히려 흥미로웠다. 공감에는 옳고 그름이 없기 때문이다.  - 드라마 내내 눈을 못 마주치는 우영우가 ""뿌듯함""의 감정을 처음 느끼고 카메라를 똑바로 응시하는 엔딩이 너무 좋았다. 악한 사람이 없어서 특이한 드라마. 장애인에게 배려가 아닌 공감을 강조하는 긍정적이고 좋은 드라마.",626,4.5
watcha,이상한 변호사 우영우,Extraordinary Attorney Woo,2022,고희준,캐릭터의 매력 서사 다 챙겨버린 욕심꾸러기,23,5.0
watcha,이상한 변호사 우영우,Extraordinary Attorney Woo,2022,류지현,슬의랑 비슷한 분위기. 다채로운 에피소드.,23,4.0
watcha,이상한 변호사 우영우,Extraordinary Attorney Woo,2022,화이트도어,우영우가 회전문 앞에서 좌절하다가 결국 회전문을 통과하는 것으로 끝맺음한다. 아마 현실은 이와 비슷하리라.  자폐인이 사회생활 만랩이나 할수 있는 행동을 버젓이 하지만 이건 좌절한 자들의 꿈을 대변한 것인지도 모른다. 요컨대 우영우의 활약담은 많은 유영우 들의 꿈이란 거지  나도 같이 꿈 꾸면서 한 동안 즐거웠다. 그럼 됐지 뭐.,185,4.0
