site,title,title_en,year,reviewer,review,review_length,rating
watcha,오징어 게임 시즌 1,SquidGameSeason1,2021,노아,나만 엄청 재밌게 본 건가..?  예상치 못한 평이 쏟아지네..  한국에서 이런 분위기의 작품은 거의 없다시피해서 시도 자체가 되게 신선하고 좋았는데  깊은 생각 없이 보면 시간 가는 줄 모르는 작품,111,4.0
watcha,오징어 게임 시즌 1,SquidGameSeason1,2021,NANA,스포일러가 있어요!!보기,13,0.5
watcha,오징어 게임 시즌 1,SquidGameSeason1,2021,영화보고 밥먹고 커피마시고 산책해요,"현대 사회의 무한 경쟁과 불평등, 그리고 돈의 논리가 생명보다 우선시되는 탐욕을 비판하려 했던 걸까, 아니면 단순히 폭력적인 오락 영화를 만들고 싶었던 걸까?  무의미한 살육 장면들은 불편함을 넘어 피로감을 느끼게 한다. 마치 충격적인 연출만을 위해 제작된 드라마처럼 보인다.  이미 일본에서 묻지마 살육 게임이라는 소재가 과소비된 상황에서, 보다 새롭고 강력한 강점을 제시했어야 한다고 생각한다. 현재 K-컬처가 글로벌 대중문화의 중심에 서 있는 만큼, 이제는 ""한국치고는 시도가 좋았다""는 식의 헐렁한 잣대는 통하지 않는다 생각한다.  개연성 없는 모순적 설정들, 치밀하게 짜인 이야기보다는 자극적인 극단 상황에 의존하다보니 장르 특유의 서스펜스가 약하다. 또한, 과장된 연기와 일관성 없이 변화하는 캐릭터성, 현실감 떨어지는 문어체 대사는 배우들의 역량을 온전히 살리지 못한다. 특히 관객이 감정이입할 수 있는 매력적이고 설득력 있는 인물이 부재하다는 점은 극의 몰입도를 떨어뜨리는 요소로 작용한다.  개인적으로 유년 시절의 순수한 놀이를 잔혹한 생존 살육 게임으로 변형시킨 설정은 적지않은 충격과 함께 복합적인 씁쓸함을 안겼다.",579,2.5
watcha,오징어 게임 시즌 1,SquidGameSeason1,2021,다이,오징어짬뽕,5,0.5
watcha,오징어 게임 시즌 1,SquidGameSeason1,2021,파반느,"시간가는 줄 모르고 너무 재미있게 봤는데 왓챠에는 뭐가 이리 불편들한 방구석 영화감독들이 많나 싶다.  몇년간 왓챠 별점을 매겨온 내가 관찰한 방구석 무비메이커들의 특징은 아래와 같다. 근 2년동안 꼴보기 싫은 댓글들이 기하급수적으로 늘어나는 것 같아 몇 글자 적어본다.  1. 개연성을 최우선 가치에 둠 - 사실 개연성이 그 영화의 완성도를 결정짓는 척도는 아님에도 뻑하면 개연성이 없다느니 부르짖고 별점 2점 이하로 줌 - 뻔하다느니 너무나 예측가능 하다느니 하는 코난 빙의자들이 판을 침. 예상되더라도 그런 결과를 이끌어가는 장치들과 복선이 흥미로운거지 않은가? 나는 항상 내가 생각한 방향과 맞아 떨어졌다고 뻔해.. 그래서 구려라는 생각은 해본적이 없는데.  2. 여성이 약자로 나오거나, 지나친 폭력에 노출되는 것을 혐오함 - 이 외에 작금 다양한 사회적 갈등요소들이 투영되어 있는 부분을 극도로 수준 낮다고 하는데 다 떠나서 그런거 다 빼면 ㅅㅂ 무슨 재미로 영화 드라마 보냐... - 특히 여자가 당하는 장면이 있는 영화마다 악플을 다는 몇몇 회원의 과거 댓글들을 살펴보면 아주 가관임.. 걸캅스에는 개연성 어쩌고 얘기 안하더라.  3. 연기가 어쩌고 저쩐다는 댓글들이 판을 침 - 최고 다빈도 댓글로 이런거 제일 많이 봄 ""누구누구 연기빼면 아무것도 없는 영화"" 연기 얘기 아니면 뭐 할 말이 없는건가.. 연기하는게 직업인 연기자들이 작품에 잘 녹아들고 개쩔게 연기하는게 어찌보면 당연한 거 아닌가.  4. 이 모든걸 종합하자면 우리 방구석 연출가들의 고매한 수준에 부합하는 영화 드라마가 나오기는 쉽지 않아 보인다.",801,5.0
watcha,오징어 게임 시즌 1,SquidGameSeason1,2021,쵸쵸,스포일러가 있어요!!보기,13,1.0
watcha,오징어 게임 시즌 1,SquidGameSeason1,2021,minnn,스포일러가 있어요!!보기,13,0.5
watcha,오징어 게임 시즌 1,SquidGameSeason1,2021,그로밋,왜 넷플릭스에서 CJ 냄새가…,16,2.0
watcha,오징어 게임 시즌 1,SquidGameSeason1,2021,지민,나만 밤새고 몰아봣나 ?,13,5.0
watcha,오징어 게임 시즌 1,SquidGameSeason1,2021,라이언고슬밥,진짜 vip는 이걸 보고있는 우리가 아닐까?,24,5.0
watcha,오징어 게임 시즌 1,SquidGameSeason1,2021,한지효,평등 좋아하시네요,9,0.5
watcha,오징어 게임 시즌 1,SquidGameSeason1,2021,삼칠,감독이랑 작가는 미술팀 전부에게 석고대죄해도 모자르다 허접하다못해 쓰레기같은 개연성을 미술덕분에 예고편 어그로에 성공이라도 했으니까,73,0.5
watcha,오징어 게임 시즌 1,SquidGameSeason1,2021,간스비,이게 스위트홈같은 졸작보다 별점이1점이나낮은게 말이안돼서 5점줌. 왓챠특성상 불편하신분들이 많아서그런가. 이게그정도 별로인작품은 아니었는데. 한국드라마에서 이런시도가 나왔다는것 자체로 높은점수 주고싶다. 물론 약간 뻔한면도있으며 신파가 좀 껴있고 북한여자는 연기를못하는건지 감독이 지도를 잘 못시킨건지모르겠다는 단점이있음. 그렇지만 킬링타임용으로 매우볼만함. 그렇게 저평가당할 작품이 절대아님. 다만 시즌2는 안나왔으면좋겠음. 좀만다듬었어도 더 좋았을작품. 한국에서 이런류의 장르가 많이나와줬으면  +) 경찰과 형의 이야기는 좀 많이아쉽다. 그래서 별점반개뺌. 설명이안되는부분도있고 너무 허술하게 캐릭터를만들었음. 차라리 없는게더나았을수도,357,4.5
watcha,오징어 게임 시즌 1,SquidGameSeason1,2021,먹태,인간의..추악함......어둠의...다크니스... 쿡 ... 내내 이런 느낌임 양육비도 제대로 안 주고 자격지심 쩔어서 엄마 수술비도 날린 놈이 알고보니 착한 남자? 음ㅋㅋㅋㅋㅋㅋㅋㅋㅋㅋㅋㅋㅋㅋㅋㅋㅋ 하차합니다,117,0.5
watcha,오징어 게임 시즌 1,SquidGameSeason1,2021,으음,시즌 2를 노리고 만든 거 같은데... 너무 구림 사회 비판용 작품인 거 같다만 너무 겉핥기 식으로 풍자를 하니 깊이도 없고 재미도 없고 감동도 없음 대사도 올드하고 연출도 올드하고 여자 캐릭터를 쓰는 방식도 참...ㅎ 쓸데없는 서사를 부여하기 바빠서 그런지 그냥 드라마판 cj 감성을 보는 느낌이었음 옛 시대적 감성을 감추기 위해서 캐스팅도 세트장도 돈 많이 쓴 느낌이던데 그래서 더 이질감 들고 별로였음 내용도 예상가게 너무 뻔했고 기대 많이 했는데 본편보다 예고편이 더 재밌던 거 같음,274,2.0
watcha,오징어 게임 시즌 1,SquidGameSeason1,2021,irene,세상에서 가장 젊었던 내 9시간 돌려줘,21,0.5
watcha,오징어 게임 시즌 1,SquidGameSeason1,2021,윤제아빠,창조적이고 창의적이진 못하나 수준급이고 현대적으로 보인다. . . #이감독은지독히상업적이다 #넷플릭스와궁합이잘맞는다 #남한산성과수상한그녀에서 #보여진장점이다녹아들었다 #좋은미장센이었지만아쉽다 #세련되긴해도아름답진않다,120,3.5
watcha,오징어 게임 시즌 1,SquidGameSeason1,2021,시영시,그나마 영화로 만들었으면 더 나았을 것 같다. 뭐랄까 2시간으로도 충분할 것 같은 걸 9화 분량으로 만드니까 갈수록 늘어지는 느낌 ...? 기억 나는 건 그냥 알록달록한 색감 그리고 까메오 정도...,111,3.0
watcha,오징어 게임 시즌 1,SquidGameSeason1,2021,묵자,"한 줄 요약: 오징어 망겜. 9화 끝까지 다 봤습니다. 여러분이 1-2화에서 예측할 수 있는 반전, 결말 모두 그대로 전개됩니다. 늘어지는 긴장과 무의미한 반전, 쓸데없는 클리셰 모두 끝까지 우리를 괴롭히고요. 5화부터 반쯤 넘기며 보았고, 7화부터 최악을 1분 1초 단위로 갱신합니다. 인물들 스토리는 다 스킵하며 보게 되고, 기가 차는 전개도 후반부에 많음. 어정쩡하게 사회 비판을 하려던건지 말미에는 교훈도 주려고 해서 정말 정말 정말 무궁화 꽃에 총맞아 죽는 것보다도 끔찍합니다. 오징어망겜 볼 시간에 제발 다른 작품 봐주세요!",299,1.5
watcha,오징어 게임 시즌 1,SquidGameSeason1,2021,ㅅㅇ,스포일러가 있어요!!보기,13,0.5
watcha,오징어 게임 시즌 1,SquidGameSeason1,2021,노진우,"괜찮은데 평이 짜네 모두들  나쁘지않았고 이런 시도가 넷플릭스가 아니었다면 불가능했을텐데 좋은 시도이고, 시슨2에서는 좀 더 다듬어진 모습이었으면 좋겠다",85,3.5
watcha,오징어 게임 시즌 1,SquidGameSeason1,2021,JIGSAW,아직 초반부까지만감상했지만 한국에서 이런류의 매니악한장르물이 퀄리티 좋게 뽑힌거만으로 충분히 의미가있다 생각한다 이정재 연기도 훌륭하고 지금까진 만족 뒤로갈수록 고어한 데스게임이 다양하게나오길 기대해본다  +사실 첨에는 다양한 레퍼토리의 한국식 고어데스게임을 감상하고싶었는데 거의 총기로만 죽이고 있으니까 데스게임 장르특유의 볼거리가 부족하고 게임선정과 구성이 밋밋해서 좀아쉽다고 느껴지긴했으나 오히려 이점이 강점이되어 게임은 쉽게 이해한다음 인물들의 감정에 집중하게되고 더높은 공감대를 형성해서 세계적으로 크게성공한게 아닌가싶다 그리고 혹평하는쪽도 이해가지만 넷플에서 킬링타임용으로 충분히 볼만한편인데 지나치게 까이는감이있네 만약 후속작이 나온다면 단점들을 보완해서 나오길바라며 후한점수를줌,387,4.5
watcha,오징어 게임 시즌 1,SquidGameSeason1,2021,다솜땅,"넷플릭스가 넷플릭스 했다.. 물론, 한국형으로…. 이질적인 면이 가득했는데. 넷플스타일이었구나…;;; 배틀로얄이나 라이어게임같은 잔인함이 난무했는데, 인간적인 철학까지 덤으로 담았으니…, 잔인함이, 비인간적임이 난무하여 오히려 마음속의 반감이 들게 만들었다. 더 인간다워야 하고 더 돈에 얽매이지 않으려.., 하지만 너무 비인간적이고 돈돈돈 하는 세상을 살아가면서.. 어디서부터 인간적이고 어디까지가 비인간적인것인지 분간이 가지 않는다. 말로는 복지, 사람우선이라며서 이미 자살률 세계1위를 찍고 있는 한국이다. 죽는원인에 아마 다섯손가락 안쪽이 자살일것인데... 자살은 뉴스에서도 많이 다루지 않는다. 연예인 자살만 방송에 나올뿐... 오징어게임이란 정겨움과 인간적이지 않은 게임앞에 우리는 모두 무릎을 꿇어가고 있다. #21.9.20 (136)",418,4.0
watcha,오징어 게임 시즌 1,SquidGameSeason1,2021,쏠h,대사랑 캐릭터 설정 다 모두 구시대적이고 평면적임. 외국인 노동자랑 새터민 묘사 기분나쁠정도로 스테레오타입에 쩔어있음. 웬만하면 중반까진 보고 평을 남길텐데 너무 최악이라 그냥 1화보고 탈주함. 배우들 연기는 어색하고 주인공 엄마가 딸 찾아야하지 않겠냐고 하는 것도 불쾌했음…사람들 죽는 장면이 나치시대를 떠올리게 하는데 그거에 대한 비판이 잘 담겼는지는 모르겠고 포르노마냥 보여줌. 헝거게임만큼 긴장감 넘치지도 않고…잔인함의 명분이 없음.,246,0.5
watcha,오징어 게임 시즌 1,SquidGameSeason1,2021,송부귀영화,마지막화까지 시청자와 게임을 하고 결국 끝까지 완주한 시청자가 이긴 듯 하지만 진 것만 같은 기분 성기훈도 이런 기분이였을까,69,2.5
watcha,오징어 게임 시즌 1,SquidGameSeason1,2021,moodindigo,보다 보니 다른 것 보다 죙일 영상 찍고 있는 경찰 양반 폰은 어케 충전하나 vip 양반들 저 가면 쓴 상태로 와인은 대체 어케 먹나 사소한 디테일들 엄청 신경 쓰이네 이거…,97,2.0
watcha,오징어 게임 시즌 1,SquidGameSeason1,2021,엘그,"평가가 짜도 너무 짠거 아닌가..  이것보다 훠얼씬 뻔하고 클리셰 범벅인  공중파 및 방송사 드라마들도  3점이상은 무난히 받는데 이게 0.5-2점대 작품이라고?  이러니 한국 제작사들이 돈 적당히 투자해서  맨날 뻔한 로코아니면 훈훈하고 따듯한 신파드라마나  주구 장창 계속 만들지..  자극적인거 만들어봐야 막장, 불륜이겠고..  그럼 무난한 시청률과 평가는 확보되니까..  세트, 비쥬얼, 스케일, 음악, 배우진들 등  기존 흔하디 흔한 한국 드라마들에 비해서는  몰입감이나 재미요소를 주는 부분들은 충분히 있었고  3.5점 정도는 무난히 받을만한 작품이라고 봄",317,3.5
watcha,오징어 게임 시즌 1,SquidGameSeason1,2021,순애필,스포일러가 있어요!!보기,13,0.5
watcha,오징어 게임 시즌 1,SquidGameSeason1,2021,도서관 미어캣,"스테레오 타입 그 자체인 등장인물들. 극한 상황에서도 인간성을 잃지 않는 주인공부터 시작으로 극한 상황에 몰려 주인공과는 다르게 인간성을 점점 잃어가는 서브 주인공, 드센 탈북인, 월급 못 받은 순수한 외국인 노동자, 살기 위해 무엇이든 하는 여성, 사람 죽는 거 보면서 즐기는 높으신 분들 등등 죄다 어디서 본 전형적인 설정에 여성 캐릭터 설정은 특히 평면적이고 여성혐오도 심하다. 다음 이야기가 어떻게 될지, 이 캐릭터가 어떻게 될지 뻔히 보인다. 물론 전형적인 등장인물들로 충분히 재밌게 만든 영화나 드라마가 많음에도 불구하고 전형적인 인물들에 대한 서사까지 대충이라 시청자들로 하여금 지루함을 느끼게 한다. 또한 다음 장면이 뻔히 예상되는데 쓸데없이 질질 끄는 연출도 몰입감을 떨어뜨린다. 그런 장면을 뺀다면 훨씬 분량을 줄이고 드라마에 긴장감을 줄 수 있었을 것이다.",434,1.5
watcha,오징어 게임 시즌 1,SquidGameSeason1,2021,Nyx,호불호가 갈린다지만 넷플릭스 전세계 1위는 아무나 하는게 아니다 클리셰 이야기를 하지만 최소한 전 세계인들에게는 신선한 소재와 재미를 줬다는 이야기이고 무엇보다 오징어게임의 성공이 시사하는 바가 큰데 아시아문화의 허브로 자리매김하고 있는 한국에 넷플릭스의 투자확대가 이어짐으로써 더 많은 K-드라마가 제작 될 것이고 이는 또한 공중파와 종편에서 빛을 보지 못했던 많은 좋은 배우들의 기회로 이어 질 수 있지 않을까..,233,4.0
watcha,오징어 게임 시즌 1,SquidGameSeason1,2021,순심이는참지않지,"아…….(탄식)  1화 30분째 보는데 그때부터 어쩐지 쎄하더라… 딱 예상한대로 흘러가는 전개, 조연급들 연기는 구멍이 많아 어설프고 (이런 연기력으로 왜 굳이 탈북민 설정?) 연출은 그냥저냥 명절에 많이 본 한국영화 수준.  1화의 하이라이트인듯한 숨바꼭질 장면은 예고편에서 쓴 그게 다였고, 그 이상 더 담을 것이 없는데 쓸데없이 길어 지루하다.  투표씬에서 한 명씩 돌아가며 찬반 발언하는 장면에선 확신했음. ‘아, 이거, 각본이 진짜 구리구나..’  미술은 나름 좀 신경 쓴 것 같은데 나머지가 전부 기대치 아래거나 전형적임.  한줄평을 적자면 새로운척, 세련된척 홍보했던 구닥다리.",330,2.0
watcha,오징어 게임 시즌 1,SquidGameSeason1,2021,서영욱,나 만근추,5,3.5
watcha,오징어 게임 시즌 1,SquidGameSeason1,2021,최주영🌈,"내가 말했잖아, 영화 기생충이 아무리 잘 만들어졌어도, 본 사람들은 “선 넘었네”, “리스펙트”나 따라하면서 밈처럼 소비할거라고. 계급사회 대한민국에 대한 패배감에 공감할뿐 진실로 고민하거나 분노하지 않을거라고. 오징어게임도 지금 다들 오징어게임 설치미술 앞에서 인증샷을 찍고 나라면 살겠네 나라면 죽겠네 농담을 할뿐… 그 누구도 이 세상의 바닥의 빚쟁이들 사이의 데스매치가 누구의 유흥인지 생각해보지 않고, 사람 목숨이 정말 1억짜리인지 의문을 제기하지 않고, 자본주의 위의 미디어가 자극적일수록 신나는 서커스일뿐이라는건 그런 비유라는건 아무도 돌아보지 않잖아. 다들 참가를 흉내내고 싶어서 열이 올랐잖아. 드라마를 보면서 노출된 번호에 전화를 걸잖아. 드라마가 재밌으니까 설정이 일관적이지 않아도 메세지와 장면이 상충되도 딱히 아무말도 하지 않잖아. DP를 보면서 위계폭력을 흉내낸대잖아. 중고등학생들이. 국민엠씨가 살아있네~ 를 몇번이고 지껄이는데 그 대사가 처음 쓰인 영화 장면은 아무도 굳이 생각하지 않잖아. 앞으로도 이럴거야. 계속 이러겠지. 우린 자극적인 장면과 귀에 박히는 대사들에 현혹되서 맥락과 메세지를 거세할거야. 그리고 맥락과 메세지를 이해하고 그걸 생각하거나 비판하려는 사람들은 비아냥만 받겠지. 그럴거야. 끔찍한 시대를 살아보자구, 세상은 토론장이 아니라 서커스장이니까. 재밌는 것은 살아남고 진지한 것은 무시되는 세상이니까. 장면은 기억되고 맥락은 도려내지는 세상이니까. 대사는 반복되지만 메세지는 잊혀지는 세상이니까.",753,3.5
watcha,오징어 게임 시즌 1,SquidGameSeason1,2021,인생은 한편의 영화,스포일러가 있어요!!보기,13,3.5
watcha,오징어 게임 시즌 1,SquidGameSeason1,2021,예진,스포일러가 있어요!!보기,13,2.0
watcha,오징어 게임 시즌 1,SquidGameSeason1,2021,엽이,긴장감 0 보는 내내 지루하다못해 눈살찌푸려지는 전형적인 한국 드라마,38,0.5
watcha,오징어 게임 시즌 1,SquidGameSeason1,2021,지영,스포일러가 있어요!!보기,13,1.5
watcha,오징어 게임 시즌 1,SquidGameSeason1,2021,하루뽀뽀♡,"전 세계 수많은 나라 넷플릭스에서 1위를 차지하고, 호평이 쏟아지는 반면, 정작 우리나라에서는 졸작이라는 이상한 평가가 내려지는 현실..... 누가 이상한것일까??",91,4.0
watcha,오징어 게임 시즌 1,SquidGameSeason1,2021,아윽으악,왜 이렇게 평점들이 안좋지… 인상깊게 본 나만 이상해지는 느낌인데,36,4.0
watcha,오징어 게임 시즌 1,SquidGameSeason1,2021,차지훈,"신파와 클리셰를 깨부술 정도로 가공할만한 힘을 가진 생존게임의 잔인한 룰들, 그리고 인간 본성. 삶은 오징어게임 퍼레이드 위에 서있음을 단편적이더라도 내비춘 면이 좋았다. 생존게임물은 개취라 객관적 평가가 어렵지만 '재미'로 따지면 까일 정도는 아니라 생각하는 작품.",149,4.0
watcha,오징어 게임 시즌 1,SquidGameSeason1,2021,simple이스,"오락성만 456개 넣었어야 할 장르에 이것저것 다 섞더니. . . 더 고어하던가 최소 신파는 빼던가, <D.P.>의 성공을 잇지 못하는 넷플릭스 특유의 기대가 큰 만큼 실망도 큰 작품.",103,2.0
watcha,오징어 게임 시즌 1,SquidGameSeason1,2021,신동연,넷플릭스의 10초 건너뛰기와 1.5배속 기능을 감사하게 만드는 드라마  솔직히 개연성이 너무 없고 각 잡고 태클 걸면 매화마다 태클 걸 수 있을 정도지만 난 순수하게 재미를 추구 하는 사람이기 때문에 그냥 드라마적 허용(?) 으로 넘기련다.  이래놓고 하루만에 다 봄,149,4.5
watcha,오징어 게임 시즌 1,SquidGameSeason1,2021,Fred의 영화일기,"현대사회의 빈부격차, 인간소외, 자본만능, 배금주의가 잘 함축된 놀라운 우화.  ※ <왕좌의 게임>은 칭송해마지 않던 사람들이 고작 이정도 가지고 '지나치게' 폭력적이라고 까는 게 웃길 뿐ㅋ",106,0.5
watcha,오징어 게임 시즌 1,SquidGameSeason1,2021,김동휘,1화 봄. 그닥 다음편 보고싶은 마음 없어서 끔. 뭐 살육게임에 별 기괴하지도 않은 미쟝센 섞고 음악 섞고 하면 수작처럼 보일 줄 알았나 랄까 별 감흥 없는 총살 장면 수없이 보여지는게 제일 노잼이었던 부분. 다음에 마저 보게 되면 다시 평해야지  수정! 아 어제 마저 다 봤는데 굳이 귀찮아서 냅뒀는데 댓글로 다보고 평해야 한다길래 별점 다시 매겼습니다.. 저는 다른 이들의 취향 폄하하거나 존중하지 않은 적 없습니다 참고로..,240,0.5
watcha,오징어 게임 시즌 1,SquidGameSeason1,2021,현비,"하••• 나 진짜 한숨나와 처음부터 끝까지 어디서부터 손댈지 모르겠는 여혐, 뭔가 대단한 내막을 가진 척 해놓고 실상은 겨우 이거?  +클리셰 범벅. 전형적이고 답답함 넷플 1.5배만 되는게 통탄스러웠음 새벽지영 장면만 그나마 볼만했음 몇개월간 기다렸는데 이게 뭐냐ㅠ 걍 청불하고싶어서 자극적 요소만 때려넣은 셈 ..~ 넷플 오리지널이라 기대했는데 실망이다 넷플아",203,2.0
watcha,오징어 게임 시즌 1,SquidGameSeason1,2021,Niknik,"어린 시절 엄마들이 연탄집게를 가지고 우리네를 닦달하며 쥐잡듯 팼을때는 엄마의 잘못이 아니라 애들이 그럴만한 짓을 했거나 오죽했을 이유가 있으니 저 집 엄마가 그랬을거라 말했다. 선생이 애들을 패도 사랑의 매라 포장하고 매가 아닌 폭력을 행사해도 선생의 잘못이 아니라 학생이 맞을짓을 했을거라 으레 용인됐다. 현 시대 지금의 시점에서 바라보면 10대 20대들의 사고엔 전혀 이해되지 않을 처우 일뿐더러 사회 통념상 그런 짓을 벌이면 아동학대로 바로 신고당할 감이다. 흔히 말하는 그때는 맞고 지금은 틀리다의 예다. 그런데 여기서 다루는 놀이문화는 정반대 이다. 등장하는 모든 놀이들은 그 시절 순수했던 아이들을 그래도 아이답게 성장하게 했고 한 인간이 성인이 되기까지 이데올로기를 형성하는 토대에도 영향을 줄만큼, 그 시절 유년을 보내온 모든 대한민국 이들에게는 나무랄데 하나 없는 순수 놀이들이다. 그 놀이를 평등으로 포장하여 최악의 수단으로 삼고 파격을 논한다. 그렇다면 누구보다 그 시절을 보내오고 정통하게 이 놀이를 즐겼던 나의 입장에선 감탄 또는 소름 혹은 쇼킹이라는 감정이 느껴져야 할텐데 불쾌와 실망감이 섞인 원초적 이 기분은 이 영화에 대한 느낌을 포장하지 않은 내 감정이란 얘기다. 9편의 에피소드를 보느라 투자한 긴 시간보다 오징어땅콩 한 알을 입에 넣고 와그작 하고 씹었을때 그 바삭함과 고소함 만족감 따위보다도 이하일만큼. 영화든 드라마든 거기에 바라는건 어쩌면 그때는 틀렸지만 지금은 맞다라는 기대일지도 모른다. 어린 시절에 생일날 아빠가 케잌과 통닭을 사 가지고 집에 오실걸 알고 미리 잔뜩 기대를 했는데 기다렸던 그 아빠가 술만 마시고 취한 모습으로 비틀거리며 집에 아무것도 사오지 않았을때의 그 어린 아이의 실망감은 요즘 세대들은 알까? 치킨이나 케익이야 언제든 배민으로 시키면 되지 굳이 왜? 라고 전혀 공감하지 못하지 않을지. 이 오징어게임은 그 시절을 보내온 이들에게도 요즘 시대를 살아가는 젊은 이들에게도 그 어떤 연령층에도 어필하지 못하는 이상한 취향만 묻어있다.",1008,0.5
watcha,오징어 게임 시즌 1,SquidGameSeason1,2021,강계민,"필요 없는 성적 장면, 구시대적으로 묘사되고 소비되는 여성들, 지루할만큼 뻔한 캐릭터 조합, 개연성 없는 전개, 왜 안나오나 했던 신파, 등등…  진짜 뭐 이런 총체적 난국이 다 있나.",103,5.0
watcha,오징어 게임 시즌 1,SquidGameSeason1,2021,우렁찬꼬리,"달고나,무궁화 꽃이 피었습니다,구슬치기 등등  사람들의 기억속에서 사라져가는 이런 케케묵은 오래된 놀이들이 화려하게 부활할줄 누가 알았을까  그것도 그동안의 한국 드라마에서 볼 수가 없었던 데스매치물로서  솔직히 전개 자체는 어디서 많이 본 느낌이 났지만  참가자와 진행요원 프론트맨.... 이 작품임을 바로 알수있는 독특한 미술효과에 좋은 점수를 주고싶다  외국에서 엄청 히트쳤다길래 좀 놀라긴 하였으나 그걸 제외하고도 킬링타임으로는 상당히 만족스러웠던 드라마  시즌2 나오면 무조건 볼 의향이 있다  우린 깐부잖어....",293,3.0
watcha,오징어 게임 시즌 1,SquidGameSeason1,2021,(Ro6),레전드.  생존에 대한 잔혹한 인간의 감정을 너무나 표현을 잘한 작품.,39,1.0
