site,title,title_en,year,reviewer,review,review_length,rating
watcha,이상한 변호사 우영우,Extraordinary Attorney Woo,2022,Paul,(1화 후기) 외쳐 갓 은 빈 !!!!! 서번트증후군 다룰 때부터 전적으로 배우의 매력에 기대야 하는 것은 자명한 이치...박은빈만큼 이 역을 잘 해낼 배우가 또  있겠냐고...진짜 잘하고 사랑스럽당...법버전 굿닥터 가나요..잘돼서 시즌제까지 해버려라... 사실 1화 재판내용 자체는 평이한 전개였어서 박은빈의 우영우 캐릭 신고식+원맨쇼였음. 요즘 트렌드인 서윗하고 무해한 남주 및 까칠한듯 배려심 있는 직장동료들 캐릭도 좋다. 앞으로 어떤 에피들 채워줄지 기대된당-ㅠ-  (2화 후기) 회당 의뢰 하나씩 해결하고 갈 생각인듯? 한 회 안에 기승전결 줘야 해서 그런지 이번 편도 좀 예상 가능한 전개였...을 뿐 아니라  '엥 로펌 변호사들이 왜 이런걸 생각 못하지...' '재벌이 저렇게 만만하게 군다고...?' '싶기까지 하긴 했는데...과정이 산뜻하고 배우들이 설득력있게 연기를 잘 해서 카바됨. 씬마다 박은빈 매력터져,462,4.5
watcha,이상한 변호사 우영우,Extraordinary Attorney Woo,2022,효댕,한국에 이런 드라마가 더 많아졌으면,19,3.0
watcha,이상한 변호사 우영우,Extraordinary Attorney Woo,2022,김민정,ㅋㅋ박은빈 최고,8,1.5
watcha,이상한 변호사 우영우,Extraordinary Attorney Woo,2022,132,이게 드라마지,7,4.0
watcha,이상한 변호사 우영우,Extraordinary Attorney Woo,2022,안성훈,아직 넷플릭스에는 1화만 올라와서 1화만 봤는데 박은빈 배우님 연기가 대단하시네요 주인공의 자폐라는 상황때문에 드라마 굿닥터가 생각이났는데 이 드라마도 앞으로의 내용이 기대가 됩니다,101,4.5
watcha,이상한 변호사 우영우,Extraordinary Attorney Woo,2022,영화로봇,"플롯,연출,연기 좋다. 갈등으로 시작해 인물의 매력/특기/장애 극복하는 것이 드라마의 기본이다.",53,3.5
watcha,이상한 변호사 우영우,Extraordinary Attorney Woo,2022,'ㅅ',"히 너무 기대된다. 예고편만 봐두 박은빈 눈알연기 짱이여 - ~1화 눈물나... 잘 썼어...  ~2화 처음으로 자폐인의 마음에 대해 생각해보았다. 장강명 작가가 본인의 마음을 빗댄 것처럼 잡종견이나 6살 아이의 감정상태.. 늘상 고래 생각을 하는 이의 기분은 어떨까? 실시간으로 눈앞에서 벌어지는 일만 생각하지 않고, 진정으로 부모의 안위도 생각하는 걸까? 걱정하면 감정의 동요는 있을까? 하루종일 김밥을 싸는 아빠에게 자신의 최애 음식인 김초밥을 싸다 주는 걸 보면 아빠 생각을 안 하는 걸까, 생각을 거쳐 김초밥이 최고라는 결론을 내린 걸까? 두려움이나 아기가 어른 보고 따라 웃는 거울 반응 말고 다른 종류의 감정도 느낄까? 잘 만든 작품은 작품 속 상황을 근거로 더 상상하게 한다. 넘겨짚어 판단할 수 없는 미지의 생명체 영우! 정말 좋다 다큐도 아닌데 이해의 지평을 넓혀준다. - 준호 태사장 아들일까? 옴니버스식으로 전개될텐데, 줄기가 되는 사건은 뭘까. 미혼부라고 했으니 엄마 찾아 삼만리는 안 할 텐데 영우의 정체성 고민으로 채워질까?준호 영우 러브라인 전개가 상상이 안 된다. 수연-준호가 더 그럴듯해. 서술트릭(?) 활용해서 12화까지 전개하다가 영우는 아무랑도 이어지지 않고, 준호랑 수연이 이어질 것 같다. - ~6화 옴니버스. 옴니버스라서 고구마가 있어도, 조금 오글거려도 잘 지나간다.",678,2.5
watcha,이상한 변호사 우영우,Extraordinary Attorney Woo,2022,소소,재밌음! 근데 딱 거기까지,14,3.5
watcha,이상한 변호사 우영우,Extraordinary Attorney Woo,2022,킹갓ㄹㅇ레전드평론가,이상하게 자꾸보면 김밥땡김..,16,4.5
watcha,이상한 변호사 우영우,Extraordinary Attorney Woo,2022,불꽃끼끼,"법정물+자폐 스펙트럼 변호사의 이야기라는 점만으로도 초반부가 재미있어서, 오히려 사랑과 출생에 대한 이야기가 나오는 후반부가 진부했다.",75,5.0
watcha,이상한 변호사 우영우,Extraordinary Attorney Woo,2022,햄쥑,어린이는 지금 당장 놀아야한다,16,3.5
watcha,이상한 변호사 우영우,Extraordinary Attorney Woo,2022,Grace,끝에 갈수록 띠용 그러나 그 전이 너무 재밌다...,28,4.0
watcha,이상한 변호사 우영우,Extraordinary Attorney Woo,2022,HUU,드라마는 좋으나 현실성-0.5,16,4.5
watcha,이상한 변호사 우영우,Extraordinary Attorney Woo,2022,정인화,반걸음 디디려는 제작진에게 한걸음 디디라고 화내지는 않을래,32,3.5
watcha,이상한 변호사 우영우,Extraordinary Attorney Woo,2022,유시현,박은빈이 많이 잘해버리니 재밌게 볼 수 있다,24,1.5
watcha,이상한 변호사 우영우,Extraordinary Attorney Woo,2022,전대진,남주 스윗하노,7,3.0
watcha,이상한 변호사 우영우,Extraordinary Attorney Woo,2022,김덕훈,개꿀잼. 전혀 불편할 거 없이 잘 봤음. 마블이 욕 먹는 거는 액션 장르에 의미없고 억지스러운 PC를 넣어서임. 이런 작품은 그런 거를 대놓고 겨냥하고 의도한 작품임. 대중적으로 히트친 이유를 바로 분석 가능할 정도로 거슬릴 거 없이 치우치지 않게 잘 만들었음. 박은빈 연기 너무 잘함.,160,3.0
watcha,이상한 변호사 우영우,Extraordinary Attorney Woo,2022,레전드불주먹,연애스토리가 다 망침 장르물은 장르처럼 만들기ㅜ,26,3.0
watcha,이상한 변호사 우영우,Extraordinary Attorney Woo,2022,연緣,처음 봣을 때 신박해서 좋앗음,16,4.5
watcha,이상한 변호사 우영우,Extraordinary Attorney Woo,2022,Life is cool,"우영우..손에 꼽을 정도로 감명 깊게 본 드라마.. 내 마음도 쿵!하며 함께 가라앉았던 여러 이야기들..  당신의 맑고 깨끗한 영혼이 결국 내 마음에 남았어요. 길이길이 잊지 않을게요. 당신의 진심, 그리고 그대의 노력과 외침을..  나도 함께 힐링이 되는 것 같은 그녀의 모습 정말 멋져요. 그대가 어떤 모습이든 당신이라서 더 멋진 걸요.",190,3.5
watcha,이상한 변호사 우영우,Extraordinary Attorney Woo,2022,명승부사,꼭 보세요,5,2.5
watcha,이상한 변호사 우영우,Extraordinary Attorney Woo,2022,이민형,첫번째로 시청한 드라마,12,3.5
watcha,이상한 변호사 우영우,Extraordinary Attorney Woo,2022,군만두,영우야 사랑해,7,4.0
watcha,이상한 변호사 우영우,Extraordinary Attorney Woo,2022,예일,기러기 토마토 스위스 인도인 별똥별,19,4.5
watcha,이상한 변호사 우영우,Extraordinary Attorney Woo,2022,김민수 평론가,자폐에 대한 편견을 더 덜게 해준 훌륭한 드라마,26,4.5
watcha,이상한 변호사 우영우,Extraordinary Attorney Woo,2022,rin,넘 좋은 작품..,9,4.0
watcha,이상한 변호사 우영우,Extraordinary Attorney Woo,2022,나이스모찌,재밌게 본 드라마,9,3.5
watcha,이상한 변호사 우영우,Extraordinary Attorney Woo,2022,Saydiiiiii,봄날의 햇살까지는 집중해서 봄,16,3.0
watcha,이상한 변호사 우영우,Extraordinary Attorney Woo,2022,하고싶은말이많지만,여기서 가장 현실성 있는 캐릭터는 권민우였다,24,5.0
watcha,이상한 변호사 우영우,Extraordinary Attorney Woo,2022,소연,좋은 작품임이 분명하지만 추후에 공개된 작가 인터뷰에서 좀 깬 부분이 있고 걸리는게 있어서 높은 점수를 주기 아까움ㅜㅜ 그치만 스지니와 ena를 살린 드라마임이 확실함,93,4.0
watcha,이상한 변호사 우영우,Extraordinary Attorney Woo,2022,체리링,좋은 각본과 좋은 배우가 만나면 이런 수작이 나오는구나  어마무시한 대사량과 함께 자칫 어색할 수 있는 캐릭터를 연기로 살려버리는 박은빈의 연기 차력쇼 그리고 이 여주인공을 서포트해주는 따뜻한 주변인들,112,3.5
watcha,이상한 변호사 우영우,Extraordinary Attorney Woo,2022,숮이,봄날의 햇살이야~,9,2.5
watcha,이상한 변호사 우영우,Extraordinary Attorney Woo,2022,혜구리,정말 최고였어요 존댓말로쓰겟습니다 원래안이러는데,26,4.0
watcha,이상한 변호사 우영우,Extraordinary Attorney Woo,2022,서윤,감동적인 드라마는 나랑 안 맞는다….,20,4.0
watcha,이상한 변호사 우영우,Extraordinary Attorney Woo,2022,미미,여자들의 우정 아름답다,12,3.5
watcha,이상한 변호사 우영우,Extraordinary Attorney Woo,2022,문해진,기승전결로 따지면 얼굴은 잘그렸는데 몸통이 꽝이에요,28,3.0
watcha,이상한 변호사 우영우,Extraordinary Attorney Woo,2022,사카밤바스피스,사회적 문제를 다루는 부분에서 엥스러운 부분이 많지만.. 이런 작품이 있어야 더 좋은 작품도 나오는거겠지,58,4.0
watcha,이상한 변호사 우영우,Extraordinary Attorney Woo,2022,확신의녕바,판타지 동화입니다 그치만 동화를 자주 보여주면 그게 현실이 되어도 이상하지 않다 생각할지도,50,4.0
watcha,이상한 변호사 우영우,Extraordinary Attorney Woo,2022,이다영,막 엄청 재밋진않았,10,3.5
watcha,이상한 변호사 우영우,Extraordinary Attorney Woo,2022,이공기,이상하고 별나지만 아름답습니다,16,4.5
watcha,이상한 변호사 우영우,Extraordinary Attorney Woo,2022,송하원,쏘쏘,2,5.0
watcha,이상한 변호사 우영우,Extraordinary Attorney Woo,2022,지니지네,이상하지 않아요 우영우 변호사. 당신은 정의로운 사람이에요. 남을 돕는 마음이 외뿔고래처럼 우뚝 솟아있죠. 나도 고래를 사랑해볼게요 당신처럼.,79,4.0
watcha,이상한 변호사 우영우,Extraordinary Attorney Woo,2022,누구세요,한국 드라마는 로맨스를 좀 작작 넣으시길 바랍니다.,28,3.0
watcha,이상한 변호사 우영우,Extraordinary Attorney Woo,2022,킴댕댕,박은빈 연기와 대본이 정말 좋아요,18,0.5
watcha,이상한 변호사 우영우,Extraordinary Attorney Woo,2022,백혈탁,안 좋은 시선들이 많지만 자폐아들의 히어로물이 될 수 있는 긍정적인 시리즈이지 않은가?,48,4.0
watcha,이상한 변호사 우영우,Extraordinary Attorney Woo,2022,H22,재밌는데 뒤로 갈수록 좀..,15,5.0
watcha,이상한 변호사 우영우,Extraordinary Attorney Woo,2022,이방인,섭섭한데요,5,3.5
watcha,이상한 변호사 우영우,Extraordinary Attorney Woo,2022,기디한,명작에 로맨스 튀었다.,12,4.5
watcha,이상한 변호사 우영우,Extraordinary Attorney Woo,2022,민성,"자폐를 다루는 현실과 판타지 혹은 동화 사이의 이야기 어떻게 이런 생각을 했지 싶음  [ 5대 항목 (각 1.0점 만점) ] 1. 스토리 (이야기) 줄거리, 컨셉, 메시지가 얼마나 탄탄한가? • (1.0점) 자폐아 변호사 라는 소재가 신선하고, 이야기가 흥미진진해서 끝까지 몰입했다.  2. 연출 (볼거리) 영상미, 편집, 사운드 등 영화를 얼마나 아름답고 인상 깊게 만들었는가? • (1.0점) 뇌리에 박히는 인상적인 장면이나 음악 혹은 소리가 있었다.  3. 연기 (캐릭터) 배우들의 연기와 캐릭터가 얼마나 살아 숨 쉬었는가? • (1.0점) '인생 연기'라고 할 만큼 압도적이거나, 캐릭터가 정말 매력적이었다.  4. 주제 (메시지) 영화가 끝나고 나서, 어떤 생각이나 감정이 남는가? • (1.0점) 깊은 여운이 남거나, 생각할 거리를 주었다.  5. 재미 (개인 취향) 그래서, '나'는 이 영화를 즐겼는가? • (0.5점) 킬링타임용으로 나쁘지 않았다.",483,4.0
watcha,이상한 변호사 우영우,Extraordinary Attorney Woo,2022,제이영,전무후무한 ‘우영우’ 캐릭터. 박은빈이 너무 대단하다,29,4.5
watcha,이상한 변호사 우영우,Extraordinary Attorney Woo,2022,SSONG,옴니버스식의 구성이나 중간중간의 로맨스 감정선이 잘 이해는 안되지만 실화를 바탕으로 한 드라마란 것에 높은 점수를 주다!,67,4.0
watcha,이상한 변호사 우영우,Extraordinary Attorney Woo,2022,빈빈,기러기 토마토 스위스 인도인 별똥별 우영우,23,0.5
watcha,이상한 변호사 우영우,Extraordinary Attorney Woo,2022,김나쵸,2화 엔딩은 정말 최고다,13,4.0
watcha,이상한 변호사 우영우,Extraordinary Attorney Woo,2022,꺄르륵,"예전에 묵혀둔 마지막 4화를 드디어 다 봄,, 너무 억지스럽지도 않고 너무 자극적이지도 않고, 이만큼만 세상이 다정했으면",67,4.5
watcha,이상한 변호사 우영우,Extraordinary Attorney Woo,2022,윤수야,엄청난 스릴러가 없는 법률드라마인데도 흥미가 당겨짐,28,4.5
watcha,이상한 변호사 우영우,Extraordinary Attorney Woo,2022,잏링공개연애하면뛰어내림,재밋어요 우영우 짱,10,2.5
watcha,이상한 변호사 우영우,Extraordinary Attorney Woo,2022,녹음의 여름,7화까지는 ㄱㅊ,8,5.0
watcha,이상한 변호사 우영우,Extraordinary Attorney Woo,2022,아기쥐,장애를 극복?;;;했다는 듯한 연출 굉장히 당황스러움,29,4.5
watcha,이상한 변호사 우영우,Extraordinary Attorney Woo,2022,권성훈,"나는 이 극이 묘사해낸 인간들, 특히나 정명석이 미치도록 좋다  이 극에 주제와 완성도를 캐묻는다면 시청자들이 느꼈을 만족감을 말하긴 어렵지 않을지",82,3.0
watcha,이상한 변호사 우영우,Extraordinary Attorney Woo,2022,Toilet Man,기러기 토마토 인도인 스위스 별똥별 화장실,23,3.5
watcha,이상한 변호사 우영우,Extraordinary Attorney Woo,2022,pbh0913,개인적으로 남자 변호사가 너무 무서웠습니다.  작가님은 우영우가 가진 자폐도 사랑해 줄 수 있는 캐릭터를 만들고자 하신 것 같은데 이 사람은 우영우가 자폐를 가지지 않았으면 좋아했을까? 라는 의문이 드는 순간 몰입이 안되더라구요 보면 볼수록 제 머리에서는 안좋아했을 것 같다라는 결론이 들었고 그 순간 보기 힘들어졌습니다.,180,2.5
watcha,이상한 변호사 우영우,Extraordinary Attorney Woo,2022,김당근,초반부까지 볼만함 옴니버스 형식 드라마여서 이게 에피소드가 다 비슷하니까 끝으로 갈수록 지겨움,52,3.5
watcha,이상한 변호사 우영우,Extraordinary Attorney Woo,2022,박윤솔,대한민국에서 나오기힘든 소재로 사람들의 인식을 조금이라도 바꿔놨다는 것. 그 시도와 결과만으로도 좋은 드라마라고 생각된다,67,4.0
watcha,이상한 변호사 우영우,Extraordinary Attorney Woo,2022,김소은,지금까지 본 드라마 중 가장 좋았다,19,3.0
watcha,이상한 변호사 우영우,Extraordinary Attorney Woo,2022,우승구,직접적으로 언급하기 힘들었던 사회적 약자의 이야기를 유쾌하게 그려내 사람들의 시선을 변화시켰다.,53,4.0
watcha,이상한 변호사 우영우,Extraordinary Attorney Woo,2022,Eileen,"봄날의 햇살같은 사람, 내 주변에도 있지 않나",25,3.0
watcha,이상한 변호사 우영우,Extraordinary Attorney Woo,2022,평폭남,시즌2가 나와야 하는 드라마,15,5.0
watcha,이상한 변호사 우영우,Extraordinary Attorney Woo,2022,랑랑,처음엔 재밌게 술술봤는데 럽라와 구교환에피쯤부터 본게아까워서 의무적으로 보는중 마지막화 영우 이부동생 하나 남은듯 다른데서도 많이봤으면,75,4.0
watcha,이상한 변호사 우영우,Extraordinary Attorney Woo,2022,🐺🐺,"우영우와 주모씨 작가 자식으로 톺아보는 대한민국 자폐 인식의 끝과 끝. '말아톤'에서 뒤로 5,000발자국 정도 퇴보한 장애를 다루는 방식. 말 잘 듣고 착한, 똑똑하지만 4차원인 '예쁜 자폐'. '자폐는 스펙트럼'이라는 편하고 값싼 방패.",134,3.0
watcha,이상한 변호사 우영우,Extraordinary Attorney Woo,2022,김주형,재미있게 봤었지만 현실과 너무 거리가 있는 것 같다,28,2.5
watcha,이상한 변호사 우영우,Extraordinary Attorney Woo,2022,서리,끝까지 못봄.. 다시 봐야겠음,16,5.0
watcha,이상한 변호사 우영우,Extraordinary Attorney Woo,2022,ᄋᄋ,잘 만든 킬링타임 작품,12,5.0
watcha,이상한 변호사 우영우,Extraordinary Attorney Woo,2022,holiday,"나는 자폐인도 아니고, 자폐인 가족을 둔 것도 아니라서 무어라 말을 얹기 조심스럽지만, 보는 내내 ‘이래도 괜찮은가?’ 싶은 생각이 들었다. 누구나 좋아할 만한 것들ㅡ예쁘고, 귀엽고, 4차원의 엉뚱함, 깔끔함, 천재적임ㅡ을 취사 선택해서 만들어진 캐릭터가 ’자폐인‘을 대표하는 것처럼 대중에게 받아들여진다면? 자폐는 스펙트럼이라고 소개하긴 했지만 그 말이 ’선별된 자폐 캐릭터’를 위한 방패막이로 쓰이는 건 아닌가? 어린 자폐인들에게 우영우가 희망이 될 수 있나? 희망 고문은 아니고? 우영우를 통해 자폐를 알게 된 사람들은 현실에서 자폐인들을 우영우의 주변인이 우영우를 대하듯이 대할 수 있을까? 이 드라마는 결국 자폐인에 대한 이해를 끌어낸 것이 아니라 소비만 하다 끝난 것은 아닌가? 이런 생각들이 내내 머릿속을 맴돌아서 편하게 보지는 못했다. 판타지라고 생각하고 보면 편하다. 그런데 우리의 사회적 현실 속에서 장애를 판타지처럼 다뤄도 되는가? 또 장애라는 실제 정체성을 빌려온 이야기인데 판타지로 봐야 편해진다면 그건 서사로서 어떤 책임을 다한 걸까? 조금 더 생각해볼 문제다.  그런 것들을 떼어놓고, 드라마 자체만 보자면… 썩을놈의 로맨스 고질병에 걸린 K드라마의 전형. 로맨스 빼면 이야기를 못 만드나? 안 그래도 미디어에서 잔뜩 포장해서 보여주는 로맨틱 러브에 알러지 있는데, 이 드라마 막바지에서는 아주 가관이라 보기 힘들었다. 사랑에도 종류가 얼마나 많은데, 그놈의 로맨틱 러-부. 초반 입체적이었던 캐릭터들도 후반부 가면 전체적으로 아주 납작해진다. 특히나 초반의 다정하고 싹싹하고 잘생긴 남주 총각은 어디 가고 노잼 찡찡남만 남았는지, 참 안타깝다. 원래라면 중간에 하차했어야 했는데, 1화의 인상이 너무 강렬히 좋아서 보다 보니 16화를 다 봤네. 너무 아쉬움이 큰 드라마였다.",897,2.5
watcha,이상한 변호사 우영우,Extraordinary Attorney Woo,2022,ll._fla7,러브라인 빼주세요 연애하지 마세요,18,4.0
watcha,이상한 변호사 우영우,Extraordinary Attorney Woo,2022,황서영,정말훌륭,4,3.0
watcha,이상한 변호사 우영우,Extraordinary Attorney Woo,2022,만간조,보다가 말았어욘.. 제 끈기가 부족했을 수도 취지는 좋은 판타지 영화입니도,41,2.0
watcha,이상한 변호사 우영우,Extraordinary Attorney Woo,2022,웹툰 안봄,굳이 로맨스를 넣어야 했니..,16,3.0
watcha,이상한 변호사 우영우,Extraordinary Attorney Woo,2022,한충훈,어른들의 동화같은 너무나 따뜻한 사람들로 가득찬,26,2.5
watcha,이상한 변호사 우영우,Extraordinary Attorney Woo,2022,コモも,오랜만에 재미있게본 한드,13,4.5
watcha,이상한 변호사 우영우,Extraordinary Attorney Woo,2022,철판,법정드라마 존잼,8,3.5
watcha,이상한 변호사 우영우,Extraordinary Attorney Woo,2022,Juan,판타지로 보면 매주가 기대되는 러브코미디,22,4.0
watcha,이상한 변호사 우영우,Extraordinary Attorney Woo,2022,박시은,자폐스펙트럼을 가진 세상 모든 사람들이 우영우같으면 좋겠지만 현실은 그렇지않기에 더욱더 필요했던 드라마,57,3.0
watcha,이상한 변호사 우영우,Extraordinary Attorney Woo,2022,lllllIllIllI,"엄청난 인지도와 박은빈의 미친 연기가 있었지만, 이상하게 나는 장애 연기를 잘 못보겠더라. 그래도 무난했다.",60,2.5
watcha,이상한 변호사 우영우,Extraordinary Attorney Woo,2022,따봉츄,용두사미 그자체 그렇게 좋았던 드라마를 러브라인만으로 망쳐놓을 수 있구나... 모든 캐릭터에게 러브라인을 넣지 않으면 드라마 짤라버리겠다는 윗분들의 협박이라도 있었나,92,3.0
watcha,이상한 변호사 우영우,Extraordinary Attorney Woo,2022,WatchaPedia,우 투더 영 투더 우,11,5.0
watcha,이상한 변호사 우영우,Extraordinary Attorney Woo,2022,휴지,같이 화내고 있지만 나는 저 사람들과 크게 다른 사람인가?,32,2.5
watcha,이상한 변호사 우영우,Extraordinary Attorney Woo,2022,보는 시간,박은빈의 연기가 너무 좋다. 하지만 장애인을 내세울때는 좀더 섬세한 터치가 필요하다. 때론 있어서는 안될 현실 사이의 괴리도 있다.,73,5.0
watcha,이상한 변호사 우영우,Extraordinary Attorney Woo,2022,고구마,재미있긴하나 굳이 사랑 이야기를 넣어야 했을까? 사랑 이야기가 없어도 충분한데 계속 사랑 이야기를 넣어 피곤해졌다,63,3.0
watcha,이상한 변호사 우영우,Extraordinary Attorney Woo,2022,동현,에피소드가 심심하지 않음 가끔 물음표가 나오는 장면들이 있긴 함,35,4.5
watcha,이상한 변호사 우영우,Extraordinary Attorney Woo,2022,진인사대천명,뭔가 갈수록 애매해짐,11,4.5
watcha,이상한 변호사 우영우,Extraordinary Attorney Woo,2022,hyup,현실이였으면 좋았을 꿈 같은 이야기!  밝은 에너지로 이야기를 끌어가지만 몰입을 깨버리는 러브라인 우영우의 순수한 말과 행동을 보며 힐링됨,77,5.0
watcha,이상한 변호사 우영우,Extraordinary Attorney Woo,2022,김형규,좋은점도 나쁜점도 많은 시리즈,16,4.0
watcha,이상한 변호사 우영우,Extraordinary Attorney Woo,2022,♡☆,"박은빈님 진짜 연기 잘하네요,,, 앞으로도 이렇게 순순한 느낌인 드라마 많이 나왔으면 좋겠음",51,4.5
watcha,이상한 변호사 우영우,Extraordinary Attorney Woo,2022,Z1 로엔그람,"따뜻하고 좋은 드라마. 물론 완성도나 연출이 훌륭했냐고 하면 그정돈 아니고, 로맨스나 법정물에 쉽고 적당히 버무린게 아쉽다. 하지만 한국 드라마에서 이런 소재와 주제로 논의나 토론이 이루어 질만한 드라마가 이렇게나 성공한게 그리 많지 않다는 걸 생각하면 더더욱.",146,3.0
watcha,이상한 변호사 우영우,Extraordinary Attorney Woo,2022,꽁이,따땃하긴 해,6,3.0
watcha,이상한 변호사 우영우,Extraordinary Attorney Woo,2022,아홉,우리 인생에 응당한 응원을 받기를,18,2.0
watcha,이상한 변호사 우영우,Extraordinary Attorney Woo,2022,현아,"제 삶은 이상하고 별나지만, 가치있고 아름답습니다.",28,3.5
watcha,이상한 변호사 우영우,Extraordinary Attorney Woo,2022,슈크림,웰메이드 드라마,8,4.0
watcha,이상한 변호사 우영우,Extraordinary Attorney Woo,2022,도지,"처음에는 재밌게 봤는데 태산 대표한테 모성애..대립하는 부분도 그렇고 사귀니까 재미없음 준호가 노잼남자라 그런가 ""너는 봄날의 햇살 최수연이야…"" 이 부분은 너무 좋고",93,3.0
watcha,이상한 변호사 우영우,Extraordinary Attorney Woo,2022,박평식,"자폐도 감성 상품화하는 코리아식 눈물팔이, 원칙에서 먼저 이탈했다",36,4.0
watcha,이상한 변호사 우영우,Extraordinary Attorney Woo,2022,채병찬,연기 소재 내용 굳,10,4.0
watcha,이상한 변호사 우영우,Extraordinary Attorney Woo,2022,예스피디아,"존재 자체로 존재할 수 있는 세상을 만들어 준, 봄날의 햇살 같은 드라마",40,4.0
watcha,이상한 변호사 우영우,Extraordinary Attorney Woo,2022,안파초,박은빈의 연기가 좋다. 너무 많이 봐서 회차 내용을 외운 드라마.,36,3.5
watcha,이상한 변호사 우영우,Extraordinary Attorney Woo,2022,미디어광인,"제 삶은 이상하고 별나지만, 가치 있고 아름답습니다.",29,5.0
watcha,이상한 변호사 우영우,Extraordinary Attorney Woo,2022,램트,서해에서 자주 발견되는 고래로는 상괭이가 있습니다. 얕은 물에서 살거든요. 상괭이는 주둥이가 뭉툭한 돌고래로 등에 폭이 좁은 융기가 있습니다. 얼굴 모양이 꼭 웃는 것 같아서 귀엽습니다.,104,3.5
watcha,이상한 변호사 우영우,Extraordinary Attorney Woo,2022,4737,우영우 변호사님 행복하세요~,15,4.5
watcha,이상한 변호사 우영우,Extraordinary Attorney Woo,2022,Tooyoung,2022년 방영할때도 재밌게 보긴 했으나 그때 내 대가리가 빡대갈이라 잘 인식을 못했는데 공부 좀 하고 봤더니 이 드라마 진짜 완성도가 존나 높다.,82,3.0
watcha,이상한 변호사 우영우,Extraordinary Attorney Woo,2022,현석,자폐인을 이용하여 작가의 신념을 흩뿌리는 역겨운 드라마,30,4.5
watcha,이상한 변호사 우영우,Extraordinary Attorney Woo,2022,최현성,악역없는 호감드라마 와중에 빛나는 박은빈,22,0.5
watcha,이상한 변호사 우영우,Extraordinary Attorney Woo,2022,dh포터,토마토,3,5.0
watcha,이상한 변호사 우영우,Extraordinary Attorney Woo,2022,bexxy,차별이란 끝없는 모순에 귀여운 의문을 던지는 힐링 드라마,31,2.5
